style_simple,full_name
Brown Ale,Alaskan Brewing Co. Alaskan Amber
Brown Ale,Long Trail Brewing Co. Double Bag
Brown Ale,Long Trail Brewing Co. Long Trail Ale
Brown Ale,Uerige Obergärige Hausbrauerei GmbH / Zum Uerige Uerige Doppelsticke
Brown Ale,Ninkasi Brewing Company Sleigh'r Dark Doüble Alt Ale
Brown Ale,Uerige Obergärige Hausbrauerei GmbH / Zum Uerige Uerige Sticke
Brown Ale,Widmer Brothers Brewing Company Okto
Brown Ale,Southampton Publick House Southampton Altbier
Brown Ale,The Olde Mecklenburg Brewery OMB Copper
Brown Ale,Brauerei Pinkus Mueller Organic Münster Alt
Brown Ale,Uerige Obergärige Hausbrauerei GmbH / Zum Uerige Uerige Altbier (Classic)
Brown Ale,Yazoo Brewing Company Gerst Amber
Brown Ale,Free State Brewing Co. Ad Astra Ale
Brown Ale,Fordham Brewing Company Fordham Copperhead Ale
Brown Ale,Victory Brewing Company Ten Years Alt
Brown Ale,Mother's Brewing Company Three Blind Mice
Brown Ale,Rising Tide Brewing Company Ishmael
Brown Ale,Tuckerman Brewing Co. Headwall Alt
Brown Ale,Hops & Grain Alt-eration Ale
Brown Ale,August Schell Brewing Company Barrel Aged Schmaltz's Alt
Brown Ale,Privatbrauerei Frankenheim Frankenheim Alt
Brown Ale,Metropolitan Brewing Iron Works Alt
Brown Ale,Brauerei Diebels GmbH & Co KG Diebels Premium Altbier
Brown Ale,Mission Brewery Mission Amber
Brown Ale,Hövels Hausbrauerei Hövels Original Bitterbier
Brown Ale,Evolution Craft Brewing Company Secret Spot Winter Ale
Brown Ale,Cheboygan Brewing Company Lighthouse Amber
Brown Ale,Les Trois Mousquetaires Série Signature Sticke Alt
Brown Ale,Driftwood Brewery Crooked Coast Amber Ale
Brown Ale,Rahr & Sons Brewing Company Gravel Road
Brown Ale,Grimm Brothers Brewhouse Little Red Cap
Brown Ale,Beau's All Natural Brewing Company Festivale
Brown Ale,Buzzards Bay Brewing Moby D
Brown Ale,Rush River Brewing Company Über Alt
Brown Ale,Brauerei Im Füchschen Im Füchschen Alt
Brown Ale,O'Fallon Brewery Sticke It To The Man
Brown Ale,Blue Mountain Brewery Evan Altmighty
Brown Ale,COAST Brewing Company ALTerior Motive
Brown Ale,Detroit Beer Co. Detroit Beer Co. The Detroit Dwarf
Strong Ale,Dogfish Head Brewery Olde School Barleywine
Strong Ale,Central Waters Brewing Company Bourbon Barrel Barleywine
Strong Ale,Great Divide Brewing Company Old Ruffian Barley Wine
Strong Ale,Victory Brewing Company Old Horizontal
Strong Ale,Three Floyds Brewing Co. & Brewpub Behemoth Blonde Barleywine
Strong Ale,Lagunitas Brewing Company Olde GnarlyWine
Strong Ale,AleSmith Brewing Company AleSmith Old Numbskull
Strong Ale,Tröegs Brewing Company Flying Mouflan
Strong Ale,Rogue Ales XS Old Crustacean
Strong Ale,Hair of the Dog Brewing Company / Brewery and Tasting Room Doggie Claws
Strong Ale,Firestone Walker Brewing Co. Helldorado
Strong Ale,Uinta Brewing Company Cockeyed Cooper
Strong Ale,Brasserie Dieu Du Ciel Solstice D'hiver
Strong Ale,Uinta Brewing Company Anniversary Barley Wine
Strong Ale,Green Flash Brewing Co. Barleywine Style Ale
Strong Ale,21st Amendment Brewery Lower Da Boom Barleywine
Strong Ale,Boulder Beer / Wilderness Pub Killer Penguin Barleywine
Strong Ale,Alpine Beer Company Great
Strong Ale,Boston Beer Company (Samuel Adams) Griffin's Bow
Strong Ale,Real Ale Brewing Company Sisyphus
Strong Ale,East End Brewing Company Gratitude
Strong Ale,The Duck-Rabbit Craft Brewery Duck-Rabbit Barleywine Ale
Strong Ale,Rock Art Brewery Vermonster
Strong Ale,Smuttynose Brewing Company Smuttynose Barleywine Style Ale (Big Beer Series)
Strong Ale,Mad River Brewing Company John Barleycorn Barleywine Ale
Strong Ale,Three Floyds Brewing Co. & Brewpub Barrel Aged Behemoth
Strong Ale,Great Divide Brewing Company Barrel Aged Old Ruffian
Strong Ale,Nøgne Ø - Det Kompromissløse Bryggeri A/S # 100
Strong Ale,AleSmith Brewing Company AleSmith Old Numbskull - Barrel Aged
Strong Ale,DuClaw Brewing Company Devil's Milk
Strong Ale,Mikkeller ApS Big Worse
Strong Ale,Santa Fe Brewing Company Chicken Killer Barley Wine
Strong Ale,Big Sky Brewing Company Olde Bluehair - Barrel Aged
Strong Ale,Moylan's Brewery Old Blarney Barleywine
Strong Ale,"Middle Ages Brewing Co., Ltd. Druid Fluid"
Strong Ale,Berkshire Brewing Company Inc. Holidale
Strong Ale,Blue Point Brewing Company Blue Point Old Howling Bastard
Strong Ale,Free State Brewing Co. Old Backus Barleywine
Strong Ale,Firestone Walker Brewing Co. §ucaba (Abacus)
Strong Ale,Weyerbacher Brewing Co. Insanity
Strong Ale,Weyerbacher Brewing Co. Blithering Idiot
Strong Ale,Pelican Pub & Brewery Mother Of All Storms
Strong Ale,Anchor Brewing Company Anchor Old Foghorn
Strong Ale,Firestone Walker Brewing Co. Double Double Barrel Ale
Strong Ale,Deschutes Brewery Mirror Mirror
Strong Ale,Midnight Sun Brewing Co. Arctic Devil Barley Wine
Strong Ale,Flying Dog Brewery Horn Dog Barley Wine Style Ale
Strong Ale,Kuhnhenn Brewing Company Kuhnhenn Bourbon Barrel Barley Wine
Strong Ale,J.W. Lees & Co (Brewers) Ltd J.W. Lees Harvest Ale (Lagavulin Whisky Cask)
Strong Ale,Dry Dock Brewing Co. Bligh's Barleywine Ale
Strong Ale,J.W. Lees & Co (Brewers) Ltd J.W. Lees Harvest Ale (Calvados Cask)
Strong Ale,J.W. Lees & Co (Brewers) Ltd J.W. Lees Harvest Ale (Port Cask)
Strong Ale,Rock Art Brewery Ridge Runner
Strong Ale,J.W. Lees & Co (Brewers) Ltd J.W. Lees Harvest Ale (Sherry Cask)
Strong Ale,Olde Hickory Brewery Irish Walker
Strong Ale,Ridgeway Brewing Criminally Bad Elf
Strong Ale,Lift Bridge Brewery Commander
Strong Ale,Shipyard Brewing Co. Shipyard Barley Wine Style Ale (Pugsley's Signature Series)
Strong Ale,Brouwerij De Molen Bommen & Granaten
Strong Ale,Shipyard Brewing Co. Double Old Thumper Ale
Strong Ale,Flossmoor Station Restaurant & Brewery Wooden Hell
Strong Ale,Fuller Smith & Turner PLC Golden Pride
Strong Ale,Pelican Pub & Brewery Stormwatcher's Winterfest
Strong Ale,Stoudts Brewing Co. Old Abominable
Hybrid Beer,Brouwerij Bosteels DeuS (Brut Des Flandres)
Hybrid Beer,Mikkeller ApS Nelson Sauvignon (Nelson Sauvin Brut)
Hybrid Beer,Brouwerij De Landtsheer NV Malheur Bière Brut (Brut Reserve)
Hybrid Beer,Brouwerij De Landtsheer NV Malheur Brut Noir (Black Chocolate)
Hybrid Beer,Cobra Beer Partnership Limited Krait Prestige
Hybrid Beer,Cervejaria Sudbrack Ltda Eisenbahn Lust
Hybrid Beer,Pivovarský D&#367;m amp - Pivní Sekt
Hybrid Beer,Cervejaria Sudbrack Ltda Eisenbahn Lust Prestige
Pale Ale,Goose Island Beer Co. Honker's Ale
Pale Ale,Fuller Smith & Turner PLC Fuller's London Pride
Pale Ale,Coniston Brewing Co. Ltd Bluebird Bitter
Pale Ale,Shepherd Neame Ltd Spitfire (Premium Ale Export)
Pale Ale,Rogue Ales Younger's Special Bitter
Pale Ale,City Steam Brewery Café City Steam Naughty Nurse Pale Ale
Pale Ale,Greene King / Morland Brewery Ruddles County
Pale Ale,Foster's Group Limited Foster's Special Bitter
Pale Ale,Victory Brewing Company Uncle Teddy's Bitter
Pale Ale,Sharp's Brewery Doom Bar Bitter
Pale Ale,Two Brothers Brewing Company Long Haul Session Ale
Pale Ale,Gritty McDuff's Brewing Company Gritty McDuff's Best Bitter
Pale Ale,Greene King / Morland Brewery Old Golden Hen
Pale Ale,Hop Back Brewery plc Hopback Summer Lightning
Pale Ale,Belhaven Brewery Company Ltd. Belhaven Best
Pale Ale,"Adnams plc, Sole Bay Brewery Adnams Southwold Bitter"
Pale Ale,D.L. Geary Brewing Company Geary's Winter Ale
Pale Ale,W.H. Brakspear & Sons plc Brakspear Bitter
Pale Ale,Wychwood Brewery Company Ltd Goliath
Pale Ale,Marshall Brewing Company McNellie's Pub Ale
Pale Ale,St. Peter's Brewery Co Ltd St. Peter's Ruby Red Ale
Pale Ale,Brouwerij De Molen Op & Top
Pale Ale,Carlsberg-Tetley Brewing Ltd Tetley's Smoothflow
Pale Ale,Wellington County Brewery Arkell Best Bitter
Pale Ale,Sly Fox Brewing Company Chester County Bitter
Pale Ale,Robert Cain & Company Limited Cain's Best Bitter
Pale Ale,Ridgeway Brewing Ridgeway Bitter
Pale Ale,Cricket Hill Brewing Co. Colonel Blides Cask Ale
Pale Ale,Hog's Back Brewery T.E.A. (Traditional English Ale)
Pale Ale,Coniston Brewing Co. Ltd XB Bluebird Bitter
Pale Ale,RCH Brewery Pitchfork Rebellious Bitter
Pale Ale,Dark Star Brewing Company Limited HopHead
Pale Ale,Samuel Smith Old Brewery (Tadcaster) Samuel Smith's Old Brewery Bitter
Pale Ale,Hair of the Dog Brewing Company / Brewery and Tasting Room Little Dog
Pale Ale,St. Peter's Brewery Co Ltd St. Peter's Best Bitter
Pale Ale,Castle Eden & Camerons Brewing Company Ltd Camerons Strongarm
Pale Ale,George Gale & Company Ltd HSB (Horndean Special Bitter)
Pale Ale,Strangford Lough Brewing Company Ltd St. Patrick's Best
Pale Ale,Hook Norton Brewery Co. Ltd. Hooky Bitter
Pale Ale,Minneapolis Town Hall Brewery West Bank Pub Ale
Pale Ale,"Adnams plc, Sole Bay Brewery Adnams Bitter"
Pale Ale,Fuller Smith & Turner PLC Fuller's ESB
Pale Ale,Wychwood Brewery Company Ltd Hobgoblin
Pale Ale,Left Hand Brewing Company Sawtooth Ale
Pale Ale,Southern Tier Brewing Company Harvest Ale
Pale Ale,Shipyard Brewing Co. Old Thumper ESA
Pale Ale,Greene King / Morland Brewery Abbot Ale
Pale Ale,AleSmith Brewing Company Anvil Ale ESB
Pale Ale,Stoudts Brewing Co. Stoudt's Scarlet Lady ESB
Pale Ale,Three Floyds Brewing Co. & Brewpub Lord Admiral Nelson
Pale Ale,Yards Brewing Co. Extra Special Ale (ESA)
Pale Ale,Foster's Group Limited Foster's Premium Ale
Pale Ale,Anderson Valley Brewing Company Boont ESB
Pale Ale,Green Man Brewery Green Man ESB
Pale Ale,SweetWater Brewing Company Sweetwater Motor Boat
Pale Ale,Ska Brewing Co. ESB Special Ale
Pale Ale,Short's Brewing Company Short's Autumn Ale
Pale Ale,Gritty McDuff's Brewing Company Gritty McDuff's Halloween Ale
Pale Ale,Shepherd Neame Ltd Bishops Finger
Pale Ale,French Broad Brewing Co. 13 Rebels ESB
Pale Ale,"Middle Ages Brewing Co., Ltd. Beast Bitter"
Pale Ale,Great Lakes Brewing Company Great Lakes Moondog ESB
Pale Ale,Rock Art Brewery Magnumus Ete Tomahawkus ESB³
Pale Ale,Elysian Brewing Company The Wise ESB
Pale Ale,Woodstock Inn Brewery Red Rack Ale
Pale Ale,Gritty McDuff's Brewing Company Gritty McDuff's Christmas Ale
Pale Ale,Deschutes Brewery Bachelor ESB
Pale Ale,Elevator Brewery & Draught Haus Elevator Bleeding Buckeye Red Ale
Pale Ale,Propeller Brewery Propeller Extra Special Bitter (ESB)
Pale Ale,Blue Mountain Brewery Steel Wheels ESB
Pale Ale,George Bateman and Son Ltd. / Batemans Brewery Batemans XXXB
Pale Ale,Grand Teton Brewing Co. XX Bitch Creek
Pale Ale,"Adnams plc, Sole Bay Brewery Adnams SSB (Suffolk Special Bitter)"
Pale Ale,Driftwood Brewery Naughty Hildegard ESB
Pale Ale,Victory Brewing Company Summer Love
Pale Ale,Sixpoint Brewery Sweet Action
Pale Ale,Kona Brewing Co. Big Wave Golden Ale
Pale Ale,Deschutes Brewery Twilight Ale
Pale Ale,Flying Dog Brewery Tire Bite Golden Ale
Pale Ale,Shipyard Brewing Co. Shipyard Export Ale
Pale Ale,Real Ale Brewing Company Fireman's #4
Pale Ale,Alexander Keith's India Pale Ale
Pale Ale,Great Divide Brewing Company Samurai Ale
Pale Ale,Southern Star Brewing Company Bombshell Blonde
Pale Ale,Flying Fish Brewing Company Farmhouse Summer Ale
Pale Ale,Magic Hat Brewing Company Single Chair Ale
Pale Ale,Widmer Brothers Brewing Company Citra Summer Blonde Brew
Pale Ale,Ska Brewing Co. True Blonde Ale
Pale Ale,Two Brothers Brewing Company Prairie Path Ale
Pale Ale,Blue Point Brewing Company Blue Point Summer Ale
Pale Ale,Russian River Brewing Company Aud Blonde
Pale Ale,Half Acre Beer Company Gossamer Golden Ale
Pale Ale,Heavy Seas Beer Heavy Seas - Gold Ale
Pale Ale,Uinta Brewing Company Sum'R
Pale Ale,Big Sky Brewing Company Summer Honey Ale
Pale Ale,Pabst Brewing Company Ballantine XXX Ale
Pale Ale,Molson Coors Canada Molson Export
Pale Ale,Fulton Beer Lonely Blonde
Pale Ale,River Horse Brewing Co. River Horse Summer Blonde
Pale Ale,Lawson's Finest Liquids Knockout Blonde
Pale Ale,Thomas Hooker Brewing Company Thomas Hooker Blonde Ale
Pale Ale,DuClaw Brewing Company Bare Ass Blonde Ale
Pale Ale,New Orleans Lager & Ale Brewing Company (NOLA) NOLA Blonde Ale
Pale Ale,Alamo Beer Co. Alamo Golden Ale
Pale Ale,Mayflower Brewing Company Mayflower Golden Ale
Pale Ale,Abbaye de Leffe S.A. Leffe Blonde
Pale Ale,Brouwerij De Smedt / Brouwerij Affligem Affligem Blond
Pale Ale,Brouwerij Westvleteren (Sint-Sixtusabdij van Westvleteren) Trappist Westvleteren Blonde
Pale Ale,The Lost Abbey Devotion Ale
Pale Ale,Brouwerij Alken-Maes Grimbergen Blonde
Pale Ale,Brouwerij Duvel Moortgat NV Maredsous 6 - Blonde
Pale Ale,Brasserie Caracole Saxo
Pale Ale,Bierbrouwerij De Koningshoeven B.V. La Trappe Blond (Koningshoeven / Dominus)
Pale Ale,Brouwerij Van Steenberge N.V. Augustijn Blond
Pale Ale,Brouwerij Van Honsebrouck N.V. Kasteel Blond
Pale Ale,Brasserie de l'Abbaye du Val-Dieu Val-Dieu Blond
Pale Ale,Brasserie St. Feuillien St. Feuillien Blonde
Pale Ale,Brouwerij Kerkom Bink Blond
Pale Ale,Brouwerij Hof Ten Dormaal Blond
Pale Ale,Brouwerij Haacht NV Tongerlo 6 Dubbel Blond
Pale Ale,Perennial Artisan Ales Southside Blonde
Pale Ale,BottleTree Beer Co. BottleTree Belgian Blonde
Pale Ale,Brasserie La Binchoise (Malterie des Remparts) La Binchoise Blonde Tradition
Pale Ale,Brasserie De Brunehaut Brunehaut Blonde
Pale Ale,Brouwerij Palm NV Steenbrugge Blond
Pale Ale,Brasserie Lefèbvre SA Abbaye De Floreffe Blonde
Pale Ale,Brasserie Du Bocq La Gauloise Blonde
Pale Ale,Brouwerij Contreras Valeir Blond
Pale Ale,Old Forge Brewing Company Celestial Blond Ale
Pale Ale,Brouwerij Smisje 't Smisje Blond
Pale Ale,Brouwerij De Koninck NV De Koninck Blond
Pale Ale,Brasserie Meteor Wendelinus
Pale Ale,Brouwerij Roman N.V. Ename Blond
Pale Ale,Brouwerij Huyghe St. Idesbald Blond
Pale Ale,Brasserie Val De Sambre Abbaye D'Aulne Blonde Des Pères (Sur Lie) 6°
Pale Ale,Brouwerij Van Viven Viven Blond
Pale Ale,Choc Beer Co. / Pete's Place Belgian-Style Blonde Ale
Pale Ale,Brouwerij Van den Bossche Pater Lieven Blond
Bock,Tröegs Brewing Company Troegenator Double Bock
Bock,Spaten-Franziskaner-Bräu Spaten Optimator
Bock,Paulaner Brauerei GmbH & Co. KG Salvator Doppel Bock
Bock,Bayerische Staatsbrauerei Weihenstephan Weihenstephaner Korbinian
Bock,Brauerei Schloss Eggenberg Samichlaus Bier
Bock,Boston Beer Company (Samuel Adams) Samuel Adams Double Bock (Imperial Series)
Bock,Klosterbrauerei Andechs Andechser DoppelBock Dunkel
Bock,Dark Horse Brewing Company Dark Horse Perkulator Coffee DoppleBock
Bock,Kulmbacher Brauerei AG EKU 28
Bock,Thomas Hooker Brewing Company Thomas Hooker Liberator DoppelBock
Bock,Smuttynose Brewing Company Smuttynose S'muttonator (Big Beer Series)
Bock,Tommyknocker Brewery Butthead DoppelBock
Bock,Capital Brewery Autumnal Fire
Bock,Klosterbrauerei Weltenburg Weltenburger Kloster Asam-Bock
Bock,Utah Brewers Cooperative Wasatch Devastator Double Bock
Bock,Victory Brewing Company St. Victorious
Bock,Brauerei Schloss Eggenberg UrBock 23°
Bock,Atwater Block Brewery Atwater Voodoovator
Bock,Jack's Abby Brewing Saxonator Dunkles DoppelBock
Bock,Der HirschBrau/Privatbrauerei Höss Doppel-Hirsch
Bock,Trader Joe's Brewing Company Josephs Brau Winterfest
Bock,The Duck-Rabbit Craft Brewery Duck-Rabbit Duck-Rabbator
Bock,Klosterbrauerei Ettal / Ettaler Klosterbetriebe GmbH Ettaler Curator DoppelBock (US Import Version)
Bock,Capital Brewery Blonde DoppelBock
Bock,Brauerei Schloss Eggenberg DoppelBock Dunkel
Bock,Brauerei Tucher Brau Tucher Bajuvator DoppelBock
Bock,Kuhnhenn Brewing Company Kuhnhenn Dark Heathen Triple Bock
Bock,Gordon Biersch Brewery Restaurant Gordon Biersch Winter Bock
Bock,Thomas Creek Brewery Deep Water DoppleBock
Bock,Les Trois Mousquetaires DoppelBock Grande Cuvée Printemps
Bock,Indian Wells Brewing Company Lobotomy Bock
Bock,Pivovar Náchod a.s. Primátor Double Bock Beer
Bock,Einstök Ölgerð Icelandic DoppelBock
Bock,Sprecher Brewing Company Dopple Bock
Bock,Pennsylvania Brewing Company St. Nikolaus Bock Bier - Brewer's Reserve
Bock,Christian Moerlein Brewing Company Christian Moerlein DoppelBock
Bock,Einbecker Brauhaus AG Einbecker Winter-Bock
Bock,Brauerei Hofstetten Krammer GmbH & Co. KG GranitBock
Bock,Grand Teton Brewing Co. Double Vision DoppelBock
Bock,"Fireman's Brew, Inc. Fireman's Brew Brewnette Beer"
Bock,Weisses Bräuhaus G. Schneider & Sohn GmbH Schneider Aventinus Weizen-EisBock
Bock,Kuhnhenn Brewing Company Kuhnhenn EisBock
Bock,Kuhnhenn Brewing Company Kuhnhenn Winter Wonder Lager
Bock,High Point Brewing Company Ramstein Winter Wheat EisBock
Bock,Brauerei Hofstetten Krammer GmbH & Co. KG GranitBock Ice
Bock,Southampton Publick House Double Ice Bock
Bock,Micro-Brasserie L'Alchimiste EisBock (Congelator)
Bock,Schorschbräu SchorschBock Ice 13
Bock,Schorschbräu SchorschBock 31%
Bock,"Le Bilboquet, Brasseur Artisan La Félix"
Bock,Schorschbräu SchorschBock 57%
Bock,Lodi Beer Company EisBock
Bock,Sly Fox Brewing Company Eis Instigator
Bock,Aarhus Bryghus Black Ice
Bock,Rogue Ales Dead Guy Ale
Bock,Abita Brewing Co. Andygator
Bock,Abita Brewing Co. Mardi Gras Bock
Bock,Hofbräuhaus München Hofbräu MaiBock (UrBock)
Bock,New Glarus Brewing Company Cabin Fever
Bock,Rogue Ales John John Dead Guy Ale
Bock,Genesee Brewing Co. / Dundee Brewing Co. Dundee Pale Bock Lager
Bock,Summit Brewing Company Summit MaiBock
Bock,Einbecker Brauhaus AG Einbecker Mai-Ur-Bock
Bock,Brauerei Schloss Eggenberg Samichlaus Bier Helles
Bock,Gordon Biersch Brewery Restaurant Gordon Biersch Blonde Bock
Bock,Boulevard Brewing Co. Boss Tom's Golden Bock
Bock,Capital Brewery MaiBock
Bock,Narragansett Brewing Co. Narragansett Bock
Bock,Berkshire Brewing Company Inc. Berkshire MaiBock Lager
Bock,Stoudts Brewing Co. Stoudt's Blonde Double MaiBock
Bock,Sprecher Brewing Company Mai Bock
Bock,Gordon Biersch Brewery Restaurant Gordon Biersch MaiBock
Bock,Hacker-Pschorr Bräu GmbH Hacker-Pschorr Hubertus Bock
Bock,Rahr & Sons Brewing Company Bucking Bock
Bock,Starr Hill Brewery The Gift (WinterBock Lager)
Bock,Pivovar Náchod a.s. Primátor MaiBock
Bock,Klosterbrauerei Andechs Andechser BergBock Hell
Bock,Spaten-Franziskaner-Bräu Spaten MaiBock / Premium Bock
Bock,Atwater Block Brewery Atwater MaiBock
Bock,Les Trois Mousquetaires Serie Signature MaiBock
Bock,Pennsylvania Brewing Company PENNdemonium
Bock,Southampton Publick House Southampton May Bock
Bock,The Olde Mecklenburg Brewery FruehBock (Früh Bock)
Bock,Mahrs-Bräu Mahr's Bock-Bier
Bock,Free State Brewing Co. Brinkley's MaiBock
Bock,Brauerei Hofstetten Krammer GmbH & Co. KG Saphir Bock
Bock,Foothills Brewing Company Gruffmeister 8
Bock,High Point Brewing Company Ramstein MaiBock
Bock,"Bayern Brewing, Inc. Dump Truck"
Bock,Boston Beer Company (Samuel Adams) Samuel Adams Winter Lager
Bock,Spoetzl Brewery Shiner Bock
Bock,Boston Beer Company (Samuel Adams) Samuel Adams Chocolate Bock
Bock,Anheuser-Busch Michelob Amber Bock
Bock,Boston Beer Company (Samuel Adams) Samuel Adams Chocolate Cherry Bock
Bock,New Glarus Brewing Company Uff-da
Bock,Boston Beer Company (Samuel Adams) Samuel Adams Chocolate Chili Bock
Bock,Pennsylvania Brewing Company St. Nikolaus Bock Bier
Bock,Saint Arnold Brewing Company Saint Arnold Spring Bock
Bock,Breckenridge Brewery Pandora's Bock
Bock,Genesee Brewing Co. / Dundee Brewing Co. Genesee Bock
Bock,Einbecker Brauhaus AG Einbecker Ur-Bock Dunkel
Bock,Bierbrouwerij De Koningshoeven B.V. La Trappe Bockbier
Bock,Mahrs-Bräu Mahr's Christmas Bock
Bock,"Cervecería Cuauhtémoc Moctezuma, S.A. de C.V. Noche Buena"
Bock,August Schell Brewing Company Schell's Bock
Bock,Millstream Brewing Company Millstream Schokolade Bock
Bock,Matt Brewing Company Saranac Chocolate Lager
Bock,Granite City Food & Brewery Brother Benedict's Bock
Bock,Atwater Block Brewery Atwater Winter Bock
Bock,Creemore Springs Brewery Limited Creemore Springs UrBock
Bock,Rock Art Brewery Mountain Holidays In Vermont Rich Creamy Bock Lager
Bock,Minhas Craft Brewery Huber Bock Beer
Bock,Browar Amber Kozlak
Bock,Amarcord Birra Artigianale Italiana Nero's 1st Century Double Dark Malt Ale
Bock,Jopen Bier BV Haarlem Jopen Bokbier
Bock,Kulmbacher Brauerei AG Mönchshof Bockbier
Bock,Red Oak Brewery Battlefield Bock
Bock,Brasserie d'Achouffe Chouffe-Bok
Bock,Bierbrouwerij Sint Christoffel B.V Christoffel Bokbier
Bock,Aass Brewery Aass Bock
Bock,"Lion Brewery, Inc. Stegmaier Brewhouse Bock"
Bock,Micro-Brasserie L'Alchimiste Bock De Joliette
Bock,Dreher Brewery Dreher Bak
Bock,Weisses Bräuhaus G. Schneider & Sohn GmbH Schneider Aventinus
Bock,Bayerische Staatsbrauerei Weihenstephan Weihenstephaner Vitus
Bock,Victory Brewing Company Moonglow WeizenBock
Bock,Lagunitas Brewing Company Bavarian-Styled Doppel Weizen
Bock,Erdinger Weissbräu Erdinger Weissbier Pikantus
Bock,High Point Brewing Company Ramstein Winter Wheat
Bock,Weisses Bräuhaus G. Schneider & Sohn GmbH Schneider Weisse Tap X Mein Nelson Sauvin
Bock,Live Oak Brewing Company Live Oak Primus WeizenBock
Bock,Mahrs-Bräu Der Weisse Bock
Bock,Brauerei Michael Plank Plank Bavarian Heller WeizenBock
Bock,Brauerei Michael Plank Plank Bavarian Dunkler WeizenBock
Bock,Le Trou Du Diable La Shawinigan Handshake
Bock,Les Trois Mousquetaires WeizenBock Grande Cuvée
Bock,Cervejaria Sudbrack Ltda Eisenbahn Vigorosa (WeizenBock)
Bock,Fat Heads Brewery & Saloon Alpen Glow WeizenBock
Bock,Peak Organic Brewing Company Peak Organic Weiss Principal
Bock,Atwater Block Brewery Teufel Bock
Bock,"Bayern Brewing, Inc. Face Plant Doppelweizen"
Bock,Weissbierbrauerei Hopf Hopf Weisser Bock
Bock,Rahr & Sons Brewing Company Angry Goat
Bock,Pennsylvania Brewing Company WeizenBock
Bock,Appalachian Brewing Company Volks WeizenBock
Bock,Scuttlebutt Brewing Company Weizen Bock
Bock,Heineken Nederland B.V. Heineken Tarwebok
Bock,Olde Hickory Brewery WeizenBock
Bock,Heavy Seas Beer Heavy Seas - Yule Tide
Bock,Aktien-Brauerei Kaufbeuren AG St. Blasius WeizenBock
Bock,Blue Mountain Brewery Summer Haze Pale WeizenBock
Bock,Urban Chestnut Brewing Company Maximilian
Bock,Mill Street Brew Pub Mill Street WeizenBock
Bock,Portsmouth Brewery Portsmouth WeizenBock
Bock,Les Brasseurs Du Temps DumDuminator
Hybrid Beer,Kuhnhenn Brewing Company Kuhnhenn Braggot
Hybrid Beer,Jackie O's Pub & Brewery Baklava Braggot
Hybrid Beer,The People's Pint Slippery Slope
Hybrid Beer,Dansk Mjød A/S Old Danish Braggot
Hybrid Beer,Portsmouth Brewery Portsmouth Killer Bee
Hybrid Beer,Rabbit's Foot Meadery Biere De Miele
Hybrid Beer,Valkyrie Brewing Mjød
Hybrid Beer,"White Winter Winery, Inc. Premium Oak Brackett"
Hybrid Beer,Mountain Sun Pub & Brewery Hummingbird
Hybrid Beer,Crabtree Brewing Company Braggot
Hybrid Beer,"White Winter Winery, Inc. White Winter Brackett"
Hybrid Beer,"South Street Brewery Honey, I Can Explain"
Hybrid Beer,Saku Brewery LTD Saku Mõdu
Hybrid Beer,Craftsman Brewing Co. Craftsman Spring Braggot
Wild/Sour,Russian River Brewing Company Sanctification
Wild/Sour,Victory Brewing Company Wild Devil
Wild/Sour,Russian River Brewing Company Defenestration
Brown Ale,Dogfish Head Brewery Indian Brown Ale
Brown Ale,Dogfish Head Brewery Palo Santo Marron
Brown Ale,Rogue Ales Hazelnut Brown Nectar
Brown Ale,Big Sky Brewing Company Moose Drool Brown Ale
Brown Ale,Smuttynose Brewing Company Smuttynose Old Brown Dog Ale
Brown Ale,Surly Brewing Company Coffee Bender
Brown Ale,Lagunitas Brewing Company Wilco Tango Foxtrot
Brown Ale,Brooklyn Brewery Brooklyn Brown Ale
Brown Ale,Avery Brewing Company Ellie's Brown Ale
Brown Ale,Surly Brewing Company Bender
Brown Ale,Founders Brewing Company Founders Sumatra Mountain Brown
Brown Ale,Kona Brewing Co. Koko Brown
Brown Ale,Abita Brewing Co. Pecan Harvest Ale
Brown Ale,Tommyknocker Brewery Maple Nut Brown Ale
Brown Ale,Tyranena Brewing Company Rocky's Revenge Bourbon Brown
Brown Ale,Anchor Brewing Company Brekle's Brown
Brown Ale,Short's Brewing Company Short's Bellaire Brown Ale
Brown Ale,Hill Farmstead Brewery George
Brown Ale,The Duck-Rabbit Craft Brewery Duck-Rabbit Brown Ale
Brown Ale,Yazoo Brewing Company Dos Perros
Brown Ale,Tommyknocker Brewery Imperial Nut Brown Ale
Brown Ale,Bear Republic Brewing Co. Pete's Brown (Tribute Ale)
Brown Ale,Short's Brewing Company Good Humans
Brown Ale,Lonerider Brewing Sweet Josie Brown Ale
Brown Ale,Firestone Walker Brewing Co. Bravo Brown
Brown Ale,Boulder Beer / Wilderness Pub Flashback Ale
Brown Ale,Ale Asylum Mad Town Nut Brown
Brown Ale,Half Acre Beer Company Over Ale
Brown Ale,Abbaye de Leffe S.A. Leffe Brune / Brown
Brown Ale,Unibroue Noire De Chambly / Chambly Noire
Brown Ale,River Horse Brewing Co. River Horse Belgian Freeze Belgian Style Winter Ale
Brown Ale,Ithaca Beer Company Cold Front
Brown Ale,Brouwerij St. Bernardus NV Grottenbier
Brown Ale,Russian River Brewing Company Rejection
Brown Ale,Brasserie Artisanale De Rullés SPRL La Rullés Cuvée Meilleurs Voeux (Bière De Gaume)
Brown Ale,Rinkuškiai Alaus Darykloje Werewolf
Brown Ale,Brouwerij Corsendonk Tempelier
Brown Ale,Brouwerij Kerkom Bink Bruin
Brown Ale,Lift Bridge Brewery Biscotti
Brown Ale,Karl Strauss Brewing Company Fullsuit Belgian-Style Brown Ale
Brown Ale,Weyerbacher Brewing Co. Tango
Brown Ale,Brouwerij De Koninck NV Winter Koninck
Brown Ale,Brouwerij Haacht NV Tongerlo 6 Dubbel Bruin
Brown Ale,Brasserie Thiriez Bière De Noël
Brown Ale,Cathedral Square Brewery Belgian-Style Abbey Ale
Brown Ale,Abbaye de Leffe S.A. Leffe De Noël
Brown Ale,The Brewer's Art Brewer's Art Proletary Ale
Brown Ale,North by Northwest Restaurant & Brewery Black Jack (Bourbon Barrel Aged)
Brown Ale,Brasserie Artisanale De Rullés SPRL La Rullés Brune (Bière De Gaume)
Brown Ale,Black Raven Brewing Co. La Petite Mort
Brown Ale,Abbaye de Leffe S.A. Leffe Rossa
Brown Ale,North by Northwest Restaurant & Brewery North By Northwest Okanogan Black Ale
Brown Ale,Brouwerij Contreras Valeir Donker
Brown Ale,Ladyface Ale Companie Blind Ambition
Brown Ale,Samuel Smith Old Brewery (Tadcaster) Samuel Smith's Nut Brown Ale
Brown Ale,Cigar City Brewing Maduro Oatmeal Brown Ale
Brown Ale,Abita Brewing Co. Turbodog
Brown Ale,Lazy Magnolia Brewing Company Southern Pecan
Brown Ale,New Glarus Brewing Company Fat Squirrel Ale
Brown Ale,Cigar City Brewing Maduro Oatmeal Brown Ale - Cubano-Style Espresso
Brown Ale,AleSmith Brewing Company AleSmith Nautical Nut Brown Ale
Brown Ale,Lost Coast Brewery and Cafe Downtown Brown
