style_simple,full_name
Lager,Matt Brewing Company Saranac Rauchbier
Lager,Southern Star Brewing Company Rauchbier
Lager,New Albanian Brewing Company - Pizzeria and Public House Bonfire Of The Valkyries
Lager,Sly Fox Brewing Company Rauchbier
Lager,Brauerei Heller-Trum / Schlenkerla Aecht Schlenkerla Krausen
Lager,New Orleans Lager & Ale Brewing Company (NOLA) Smoky Mary
Lager,Starr Hill Brewery Smoke Out
Lager,Marshall Wharf Brewing Company / Three Tides Restaurant Deep Purple
Lager,Zero Gravity Craft Brewery / American Flatbread Smokey The Beer
Lager,Iron Hill Brewery & Restaurant Rauchbier
Lager,Brauerei Gasthof Kundmüller Weiherer Rauch
Lager,Brauerei Gasthof Rittmayer Hallerndorfer Raiterla Rauchbier
Lager,Appalachian Brewing Company RauchBock
Lager,Micro Cervejaria Bamberg Bamberg Rauchbier
Lager,Dragonmead Microbrewery Dragonmead Bishop Bob's Holy Smoke
Lager,Boston Beer Company (Samuel Adams) Samuel Adams Black Lager
Lager,Köstritzer Schwarzbierbrauerei GmbH & Co. Köstritzer Schwarzbier
Lager,Spoetzl Brewery Bohemian Black Lager
Lager,Uinta Brewing Company Baba Black Lager
Lager,Matt Brewing Company Saranac Black Forest
Lager,Magic Hat Brewing Company Howl
Lager,Sprecher Brewing Company Black Bavarian
Lager,Kulmbacher Brauerei AG Mönchshof Schwarzbier
Lager,Rahr & Sons Brewing Company Ugly Pug Black Lager
Lager,Královský Pivovar Krušovice a.s. Krušovice Cerne
Lager,Pabst Brewing Company McSorley's Irish Black Lager
Lager,The Duck-Rabbit Craft Brewery Duck-Rabbit Schwarzbier
Lager,Westbrook Brewing Co. Dark Helmet
Lager,Krombacher Brauerei Krombacher Dark
Lager,Einbecker Brauhaus AG Einbecker Schwarzbier
Lager,10 Barrel Brewing Co. S1nist0r Black Ale
Lager,Gordon Biersch Brewery Restaurant Gordon Biersch Schwarzbier
Lager,Austin Beerworks Black Thunder
Lager,Midnight Sun Brewing Co. BREWtality - Espresso Black Bier
Lager,Short's Brewing Company Short's Bourbon Barrel Sustenance Black Beer
Lager,Short's Brewing Company Short's Sustenance Black Bier
Lager,The Brew Kettle Taproom & Smokehouse / Production Works Ringneck Dark Helmet Imperial Schwarzbier
Lager,BrewDog Zeitgeist
Lager,Bayou Teche Brewery LA-31 Bière Noire
Lager,Weeping Radish Eco Farm & Brewery Black Radish Dark Lager
Lager,Dinkelacker-Schwabenbraeu AG Das Schwarze
Lager,Monteith's Brewing Co. Monteith's Black
Lager,Choc Beer Co. / Pete's Place Miner Mishap
Lager,Matt Brewing Company Saranac Black Lager
Lager,Pivovar Herold B&#345;eznice A.s. Herold Bohemian Black Lager
Lager,Boston Beer Company (Samuel Adams) Samuel Adams Boston Lager
Lager,Great Lakes Brewing Company Great Lakes Eliot Ness
Lager,"Cervecería Cuauhtémoc Moctezuma, S.A. de C.V. Dos Equis Amber Lager"
Lager,Devils Backbone Brewing Company Vienna Lager
Lager,Sierra Nevada Brewing Co. Sierra Nevada Vienna Style Lager
Lager,Jacob Leinenkugel Brewing Company Leinenkugel's Red
Lager,Grupo Modelo S.A. de C.V. Victoria
Lager,August Schell Brewing Company FireBrick
Lager,Pennsylvania Brewing Company Penn Pilsner
Lager,Sprecher Brewing Company Special Amber
Lager,"Cervecería Cuauhtémoc Moctezuma, S.A. de C.V. Indio"
Lager,Millstream Brewing Company Millstream Schild Brau Amber
Lager,Live Oak Brewing Company Live Oak Big Bark Amber Lager
Lager,Matt Brewing Company Saranac Season's Best - Nut Brown Lager
Lager,Metropolitan Brewing Dynamo Copper Lager
Lager,Flying Bison Brewing Company Rusty Chain
Lager,B.W. Beer Works USA The Raven Special Lager
Lager,Snake River Brewing Company & Brewpub Snake River Lager
Lager,"Hijos De Rivera, S.A. 1906 Reserva Especial"
Lager,Brasserie Pietra Amber
Lager,Brauerei Schloss Eggenberg Mac Queen's Nessie
Lager,Green Valley Brewing Company (Crooked Creek) Wild Hop Organic Amber Lager
Lager,Hinterland Brewery Restaurant Oktoberfest
Lager,Birra Menabrea SpA Menabrea Ambrata
Lager,Florida Beer Company Ybor Gold Amber Lager
Lager,"Cervecería Cuauhtémoc Moctezuma, S.A. de C.V. Bohemia Obscura"
Lager,Matt Brewing Company Saranac Winter Lager
Lager,Figueroa Mountain Brewing Co. Danish Red Lager
Lager,Spoetzl Brewery Shiner 98 Bavarian Style Amber
Lager,Left Coast Brewing Company Left Coast Una Mas Amber Lager
Lager,Iron Hill Brewery & Restaurant Vienna Red Lager
Lager,Tommyknocker Brewery Vienna-Style Amber Lager
Lager,Crescent City Brewhouse Red Stallion
Lager,The Fat Cat Beer Company Fat Cat Lager Beer
Lager,Victory Brewing Company P.J.W. Copper Lager
Lager,Tuborgs Bryggerier A/S Tuborg Classic
Lager,Wellington County Brewery Trailhead Lager
Wild/Sour,Brasserie Cantillon Cantillon Faro
Wild/Sour,Brouwerij De Troch Chapeau Faro Lambic
Wild/Sour,Brouwerij Girardin Girardin Faro 1882
Wild/Sour,Brouwerij Boon Faro Boon
Wild/Sour,Brouwerij Timmermans-John Martin N.V. Timmermans Faro
Wild/Sour,Brouwerij Mort Subite Mort Subite Faro
Wild/Sour,Brouwerij Van Honsebrouck N.V. St. Louis Premium Faro
Wild/Sour,Gueuzerie Tilquin Tilquin Faro
Wild/Sour,De Cam Geuzestekerij De Cam Faro
Wild/Sour,Brasserie Cantillon Cantillon Fou' Foune
Wild/Sour,Brouwerij Lindemans Lindemans Framboise
Wild/Sour,Brasserie Cantillon Cantillon Kriek 100% Lambic
Wild/Sour,Brasserie Cantillon Cantillon Rosé De Gambrinus
Wild/Sour,Brasserie Cantillon Cantillon Saint Lamvinus
Wild/Sour,Brasserie Cantillon Cantillon Lou Pepe - Kriek
Wild/Sour,Brasserie Cantillon Cantillon Vigneronne
Wild/Sour,Brasserie Cantillon Cantillon Framboise
Wild/Sour,Brouwerij Lindemans Lindemans Kriek
Wild/Sour,Brouwerij Drie Fonteinen Drie Fonteinen Oude Kriek
Wild/Sour,Brouwerij Lindemans Lindemans Pêche
Wild/Sour,Brouwerij Drie Fonteinen Drie Fonteinen Hommage
Wild/Sour,Brouwerij Drie Fonteinen Drie Fonteinen Schaerbeekse Kriek
Wild/Sour,Brasserie Cantillon Cantillon Mamouche
Wild/Sour,Brasserie Cantillon Cantillon Blåbær Lambik
Wild/Sour,Brouwerij Lindemans Lindemans Apple
Wild/Sour,Brouwerij Oud Beersel Oud Beersel Oude Kriek Vieille
Wild/Sour,Brouwerij Drie Fonteinen Drie Fonteinen Framboos
Wild/Sour,Hanssens Artisanaal bvba Oude Kriek
Wild/Sour,Allagash Brewing Company Allagash Coolship Red
Wild/Sour,Brouwerij Lindemans Lindemans Cassis
Wild/Sour,Brouwerij Boon Boon Kriek
Wild/Sour,Brouwerij Boon Boon Oude Kriek Mariage Parfait
Wild/Sour,Hanssens Artisanaal bvba Oudbeitje Lambic
Wild/Sour,Brouwerij Boon Boon Framboise
Wild/Sour,Upland Brewing Company Peach Lambic
Wild/Sour,Upland Brewing Company Blackberry Lambic
Wild/Sour,Upland Brewing Company Strawberry Lambic
Wild/Sour,Upland Brewing Company Persimmon Lambic
Wild/Sour,Brouwerij Oud Beersel Oud Beersel Framboise
Wild/Sour,Mikkeller ApS Spontanframboos
Wild/Sour,Upland Brewing Company Cherry Lambic
Wild/Sour,Brouwerij Mort Subite Mort Subite Kriek
Wild/Sour,Brouwerij Van Honsebrouck N.V. St. Louis Premium Framboise
Wild/Sour,Allagash Brewing Company Allagash Coolship Cerise
Wild/Sour,Hanssens Artisanaal bvba Hanssens Experimental Raspberry
Wild/Sour,Hanssens Artisanaal bvba Hanssens Experimental Cassis
Wild/Sour,Brouwerij Timmermans-John Martin N.V. Timmermans Strawberry
Wild/Sour,Brouwerij Timmermans-John Martin N.V. Timmermans Framboise Lambic
Wild/Sour,Hanssens Artisanaal bvba Scarenbecca Kriek
Wild/Sour,Brasserie Belle-Vue Belle Vue Kriek
Wild/Sour,Alpine Beer Company Chez Monieux
Wild/Sour,Brasserie Cantillon Cantillon Gueuze 100% Lambic
Wild/Sour,Brouwerij Drie Fonteinen Drie Fonteinen Oude Geuze
Wild/Sour,Gueuzerie Tilquin Oude Gueuze Tilquin à L’Ancienne
Wild/Sour,The Lost Abbey Duck Duck Gooze
Wild/Sour,Hanssens Artisanaal bvba Oude Gueuze
Wild/Sour,Brasserie Cantillon Cantillon Lou Pepe - Gueuze
Wild/Sour,Brouwerij Girardin Girardin Gueuze 1882 (Black Label)
Wild/Sour,Brouwerij Boon Boon Oude Geuze Mariage Parfait
Wild/Sour,Brouwerij Van Honsebrouck N.V. St. Louis Gueuze Fond Tradition
Wild/Sour,Brouwerij Oud Beersel Oud Beersel Oude Geuze Vieille
Wild/Sour,Allagash Brewing Company Allagash Coolship Resurgam
Wild/Sour,Brouwerij Boon Boon Oude Geuze
Wild/Sour,Gueuzerie Tilquin Gueuze Tilquin (Draught Version)
Wild/Sour,Brouwerij Drie Fonteinen Drie Fonteinen Doesjel
Wild/Sour,Upland Brewing Company Sour Reserve
Wild/Sour,Brouwerij Lindemans Lindemans Gueuze
Wild/Sour,Brouwerij Mort Subite Mort Subite Gueuze
Wild/Sour,De Cam Geuzestekerij Oude Geuze De Cam
Wild/Sour,Brasserie Belle-Vue Belle Vue Gueuze
Wild/Sour,Brouwerij De Troch De Troch Gueuze
Wild/Sour,Brouwerij Girardin Girardin Gueuze 1882 (White Label)
Wild/Sour,Brasserie Cantillon Cantillon Brabantiae
Wild/Sour,Brouwerij Mort Subite Mort Subite Oude Gueuze
Wild/Sour,Brouwerij Kerkom Reuss
Wild/Sour,Brouwerij De Troch Chapeau Gueuze Lambic
Wild/Sour,Brasserie Cantillon Cantillon Iris
Wild/Sour,Brasserie Cantillon Cantillon Bruocsella (1900) Grand Cru
Wild/Sour,Brasserie Cantillon Cantillon 50 Degrees North-4 Degrees East
Wild/Sour,De Cam Geuzestekerij Oude Lambiek De Cam
Wild/Sour,Brasserie Cantillon Cantillon Lambic
Wild/Sour,Café-Brouwerij Loterbol Tuverbol
Wild/Sour,Panil Panil Divina
Wild/Sour,Brouwerij Oud Beersel Oud Beersel Lambik
Wild/Sour,Brouwerij Boon Boon Oude Lambic
Wild/Sour,Brouwerij Drie Fonteinen Lambiek (1 Year Old)
Wild/Sour,Brouwerij Drie Fonteinen Jonge Lambik
Wild/Sour,Brouwerij Drie Fonteinen Oude Lambik
Wild/Sour,Brouwerij Girardin Lambik (1 Year Old Unblended)
Wild/Sour,Mikkeller ApS Spontanale
Wild/Sour,De Cam Geuzestekerij Lambiek De Cam
Wild/Sour,Brouwerij Boon Boon Lambiek
Wild/Sour,Brouwerij Girardin Lambik (2 Year Old Unblended)
Wild/Sour,Brouwerij Girardin Jonge Lambiek
Wild/Sour,Brouwerij Lindemans Lindemans Oude Lambik
Wild/Sour,Brouwerij De Troch De Troch Jonge Lambik
Wild/Sour,Brouwerij Girardin Lambik (3 Year Old Unblended)
Wild/Sour,Brouwerij Mort Subite Mort Subite Oude Lambik
Wild/Sour,Brouwerij Bockor N.V. Oud
Wild/Sour,Gueuzerie Tilquin Tilquin Jonge Lambic
Specialty,Anheuser-Busch O'Doul's
Specialty,Anheuser-Busch O'Doul's Amber
Specialty,Guinness Ltd. Kaliber
Specialty,Miller Brewing Co. Sharp's
Specialty,St. Pauli Brauerei C.L. Wilh. Brandt Gmbh & Co. St. Pauli N. A.
Specialty,Heineken Nederland B.V. Buckler 0%
Specialty,Erdinger Weissbräu Erdinger Weissbier Alkoholfrei
Specialty,BrewDog Nanny State
Specialty,Brauerei Beck & Co. Beck's Alkoholfrei
Specialty,Anheuser-Busch Busch NA
Specialty,Binding-Brauerei AG Clausthaler Golden Amber
Specialty,Bitburger Brauerei Bitburger Drive
Specialty,Warsteiner Brauerei Warsteiner Premium Fresh
Specialty,Pabst Brewing Company Old Milwaukee Non Alcoholic
Specialty,Paulaner Brauerei GmbH & Co. KG Paulaner Hefe-Weissbier Alkoholfrei
Specialty,Baltika Breweries Baltika #0 Non-Alcoholic
Specialty,Privatbrauerei Eichbaum GmbH & Co. KG Gerstel Non Alcoholic
Specialty,Paulaner Brauerei GmbH & Co. KG ThomasBrau
Specialty,Weisses Bräuhaus G. Schneider & Sohn GmbH Schneider Weisse Mein Alkoholfreies
Specialty,Labatt Brewing Company Ltd. Labatt Blue Non-Alcoholic
Specialty,Bayerische Staatsbrauerei Weihenstephan Weihenstephaner Alkoholfrei Original
Specialty,Brauerei Beck & Co. Haake Beck NA
Specialty,Krombacher Brauerei Krombacher Alkoholfrie
Specialty,Einbecker Brauhaus AG Einbecker Brauherren Non-Alcoholic
Specialty,Pabst Brewing Company Pabst Non-Alcoholic
Specialty,Molson Coors Canada Molson Exel
Specialty,Bitburger Brauerei Bitburger Alkoholfrei
Specialty,"Cerveceria Vegana, S.A. Malta India"
Specialty,Fentimans Ltd. Fentimans Full Bodied Shandy
Specialty,Brauerei Gebrüder Maisel GmbH & Co. Maisel's Weisse Alkoholfrei
Specialty,Brasserie Piedboeuf Jupiler NA
Specialty,Genesee Brewing Co. / Dundee Brewing Co. Genesee NA
Brown Ale,Goose Island Beer Co. Mild Winter
Brown Ale,Jester King Craft Brewery Commercial Suicide
Brown Ale,Moorhouse's Brewery (Burnley) Ltd Black Cat
Brown Ale,Motor City Brewing Works Motor City Brewing Ghettoblaster
Brown Ale,Surly Brewing Company Mild
Brown Ale,Hockley Valley Brewing Co. Hockley Dark
Brown Ale,Coopers Brewery Limited Coopers Dark Ale
Brown Ale,Neustadt Springs Brewery Neustadt 10w30
Brown Ale,Robert Cain & Company Limited Cains Dark Mild
Brown Ale,Eagle Rock Brewery Solidarity
Brown Ale,Tooheys Brewing Tooheys Old
Brown Ale,Whistler Brewing Company Original Black Tusk Ale
Brown Ale,Northwoods Brewpub and Grill Floppin' Crappie
Brown Ale,Fort Garry Brewing Company Ltd. Dark Ale
Brown Ale,Wandering Star Brewing Company Mild At Heart
Brown Ale,Sea Dog Brewing Company Sea Dog Old Gollywobbler Brown Ale
Brown Ale,Devils Backbone Brewing Company Ale Of Fergus
Brown Ale,New Albanian Brewing Company - Pizzeria and Public House Community Dark Mild Ale
Brown Ale,Calfkiller Brewing Company J. Henry Mild Brown Ale
Brown Ale,Nelson Brewing Company After Dark Mild
Brown Ale,Beacon Hotel (Sarah Hughes Brewery) Original Sarah Hughes Dark Ruby Mild
Brown Ale,Pratt Street Ale House Oliver's Dark Horse
Brown Ale,George Gale & Company Ltd Gale's Festival Mild
Brown Ale,Daniel Thwaites Brewery PLC Nutty Black
Brown Ale,Market Street Brewing Co. and Restaurant Market Street D'Artagnan Dark British Ale
Brown Ale,Rudgate Brewery Limited Ruby Mild
Brown Ale,Brasseurs De Montréal London Ruby Anglaise
Brown Ale,Montana Brewing Company Fat Belly Amber
Pale Ale,"Inveralmond Brewery Ltd., The Ossian"
Pale Ale,Moab Brewery Dead Horse Amber Ale
Pale Ale,Coopers Brewery Limited Coopers Mild Ale
Pale Ale,Cervecería Minerva Minerva Pale Ale
Pale Ale,Greene King / Morland Brewery Hop
Pale Ale,Copper Dragon Brewery Golden Pippin Ale
Pale Ale,Sea Dog Brewing Company Sea Dog Owl's Head Light Ale
Pale Ale,Simonds Farsons Cisk Plc. Blue Label Ale
Pale Ale,Rohrbach Brewing Company (Brewpub) Next Door Ale
Pale Ale,Purple Moose Brewery Snowdonia Ale
Pale Ale,Granite Brewery & Restaurant Summer Ale
Pale Ale,Daniel Thwaites Brewery PLC Thwaites Smooth
Pale Ale,Daniel Thwaites Brewery PLC Thoroughbred Gold
Pale Ale,Palos De Moguer - 82 Colón Rubia
Pale Ale,Isle of Arran Brewery Company Ltd. Arran Sunset
Pale Ale,"Badger Brewery, Hall and Woodhouse England's Gold"
Pale Ale,The Ship Inn Spring Mild
Pale Ale,Dostal Alley Brewpub Jacob Mac Mild
Pale Ale,Westerham Brewery Company Ltd Finchcocks Original
Strong Ale,Founders Brewing Company Founders Kaiser Curmudgeon
Strong Ale,North Coast Brewing Co. Old Stock Ale
Strong Ale,Great Divide Brewing Company Hibernation Ale
Strong Ale,Hair of the Dog Brewing Company / Brewery and Tasting Room Adam
Strong Ale,Kuhnhenn Brewing Company Kuhnhenn Bourbon Barrel Fourth Dementia
Strong Ale,Avery Brewing Company Old Jubilation
Strong Ale,Fuller Smith & Turner PLC Fuller's Vintage Ale
Strong Ale,North Coast Brewing Co. Old Stock Cellar Reserve (Aged In Bourbon Barrels)
Strong Ale,Kuhnhenn Brewing Company Kuhnhenn Fourth Dementia (4D)
Strong Ale,T & R Theakston Ltd. Theakston Old Peculier
Strong Ale,Hair of the Dog Brewing Company / Brewery and Tasting Room Adam From The Wood
Strong Ale,Harviestoun Brewery Ltd. Ola Dubh Special Reserve 12
Strong Ale,Hair of the Dog Brewing Company / Brewery and Tasting Room Cherry Adam From The Wood
Strong Ale,Alaskan Brewing Co. Alaskan Winter Ale
Strong Ale,Saint Arnold Brewing Company Saint Arnold Christmas Ale
Strong Ale,Harviestoun Brewery Ltd. Ola Dubh Special Reserve 16
Strong Ale,Breckenridge Brewery Autumn Ale
Strong Ale,Harviestoun Brewery Ltd. Ola Dubh Special Reserve 18
Strong Ale,Greene King / Morland Brewery Olde Suffolk English (Strong Suffolk Vintage) Ale
Strong Ale,Harviestoun Brewery Ltd. Ola Dubh Special Reserve 30
Strong Ale,George Gale & Company Ltd Gale's Prize Old Ale
Strong Ale,Lancaster Brewing Company Winter Warmer
Strong Ale,Great Divide Brewing Company Barrel Aged Hibernation Ale
Strong Ale,Eel River Brewing Co. Triple Exultation
Strong Ale,Arcadia Brewing Company Arcadia Big Dick's Olde Ale
Strong Ale,Straight To Ale Barrel-Aged Unobtanium Old Ale
Strong Ale,Mayflower Brewing Company Mayflower Thanksgiving Ale
Strong Ale,Block 15 Brewery & Restaurant Figgy Pudding
Strong Ale,Harviestoun Brewery Ltd. Ola Dubh Special Reserve 40
Strong Ale,Fish Brewing Company / Fishbowl Brewpub Old Woody
Strong Ale,Upright Brewing Company Billy The Mountain
Strong Ale,Blue Mountain Brewery Lights Out Holiday Ale
Strong Ale,DuClaw Brewing Company Old Flame
Strong Ale,Box Steam Brewery Dark & Handsome
Pale Ale,Sierra Nevada Brewing Co. Chico Special Pale Ale
Pale Ale,Three Floyds Brewing Co. & Brewpub Zombie Dust
Pale Ale,Oskar Blues Grill & Brew Dale's Pale Ale
Pale Ale,Three Floyds Brewing Co. & Brewpub Alpha King Pale Ale
Pale Ale,Toppling Goliath Brewing Company PseudoSue
Pale Ale,Half Acre Beer Company Daisy Cutter Pale Ale
Pale Ale,SweetWater Brewing Company Sweetwater 420 Extra Pale Ale
Pale Ale,Deschutes Brewery Mirror Pond Pale Ale
Pale Ale,Maine Beer Company Peeper Ale
Pale Ale,Hill Farmstead Brewery Edward Pale Ale
Pale Ale,New Glarus Brewing Company Moon Man
Pale Ale,Deschutes Brewery Red Chair NWPA
Pale Ale,Victory Brewing Company Headwaters Pale Ale
Pale Ale,Kona Brewing Co. Fire Rock Pale Ale
Pale Ale,Flying Dog Brewery Doggie Style Classic Pale Ale
Pale Ale,Three Floyds Brewing Co. & Brewpub Pride & Joy Mild Ale
Pale Ale,Firestone Walker Brewing Co. Pale 31
Pale Ale,Lagunitas Brewing Company New Dogtown Pale Ale
Pale Ale,Great Divide Brewing Company Fresh Hop Pale Ale
Pale Ale,Southern Tier Brewing Company Phin & Matt's Extraordinary Ale
Pale Ale,Ballast Point Brewing Company Pale Ale
Pale Ale,Matt Brewing Company Saranac Pale Ale
Pale Ale,Carton Brewing Company Boat
Pale Ale,Goose Island Beer Co. Green Line Pale Ale
Pale Ale,Odell Brewing Company St. Lupulin
Pale Ale,Brasserie d'Orval S.A. Orval Trappist Ale
Pale Ale,Brewery Ommegang Rare Vos (Amber Ale)
Pale Ale,Russian River Brewing Company Redemption
Pale Ale,Brouwerij Palm NV Palm / Palm Speciale
Pale Ale,Avery Brewing Company Karma
Pale Ale,"Jolly Pumpkin Artisan Ales Luciérnaga, The Firefly"
Pale Ale,Unibroue Raftman
Pale Ale,Weyerbacher Brewing Co. Verboten
Pale Ale,New Glarus Brewing Company Stone Soup
Pale Ale,Captain Lawrence Brewing Co. Liquid Gold
Pale Ale,Brouwerij De Koninck NV De Koninck
Pale Ale,Brouwerij Straffe Hendrik / Huisbrouwerij De Halve Maan Brugse Zot
Pale Ale,Brasserie de la Senne Taras Boulba
Pale Ale,Bières de Chimay S.A. Dorée
Pale Ale,DC Brau Brewing Co. The Citizen
Pale Ale,Dark Horse Brewing Company Dark Horse Amber Ale
Pale Ale,Hardywood Park Craft Brewery Singel
Pale Ale,The Lost Abbey Saints' Devotion
Pale Ale,Brouwerij Van Steenberge N.V. Bruegel Amber Ale
Pale Ale,Brasserie Dubuisson Frères sprl Cuvée Des Trolls
Pale Ale,Perennial Artisan Ales Hommel Bier
Pale Ale,Furthermore Beer Fatty Boombalatty
Pale Ale,AleSmith Brewing Company AleSmith Lil' Devil
Pale Ale,Big Boss Brewing Hell's Belle
Pale Ale,Matt Brewing Company Saranac Belgian Ale
Pale Ale,Brouwerij Slaghmuylder Witkap Pater Singel / Stimulo
Pale Ale,Brasserie de la Senne Zinnebir
Pale Ale,Russian River Brewing Company It Takes A Lot Of Great Beer To Make Great Wine
Pale Ale,Mikkeller ApS It's Alright!
Pale Ale,White Birch Brewing White Birch Belgian Style Pale Ale
Pale Ale,Philadelphia Brewing Company Fleur De Lehigh
Pale Ale,Brouwerij Van Steenberge N.V. Bière Du Boucanier Red
Pale Ale,Omnipollo Leon
Pale Ale,Firestone Walker Brewing Co. Double Barrel Ale
Pale Ale,Bass Brewers Limited Bass Pale Ale
Pale Ale,Greene King / Morland Brewery Old Speckled Hen
Pale Ale,Boston Beer Company (Samuel Adams) Samuel Adams Boston Ale (Stock Ale)
Pale Ale,Brooklyn Brewery Brooklyn Summer Ale
Pale Ale,Samuel Smith Old Brewery (Tadcaster) Samuel Smith's Old Brewery Pale Ale
Pale Ale,Smuttynose Brewing Company Smuttynose Shoals Pale Ale
Pale Ale,Great Divide Brewing Company Denver Pale Ale
Pale Ale,Cisco Brewers Inc. Whale's Tale Pale Ale
Pale Ale,Summit Brewing Company Summit Extra Pale Ale
Pale Ale,Black Sheep Brewery PLC Monty Python's Holy Grail Ale
Pale Ale,Boston Beer Company (Samuel Adams) Samuel Adams Pale Ale
Pale Ale,Yuengling Brewery Lord Chesterfield Ale
Pale Ale,Odell Brewing Company 5 Barrel Pale Ale
Pale Ale,Coopers Brewery Limited Coopers Sparkling Ale
Pale Ale,Coopers Brewery Limited Coopers Original Pale Ale
Pale Ale,Carlsberg-Tetley Brewing Ltd Tetley's English Ale
Pale Ale,Wychwood Brewery Company Ltd Scarecrow Ale
Pale Ale,Harviestoun Brewery Ltd. Bitter & Twisted
Pale Ale,Big Sky Brewing Company Scape Goat Pale Ale
Pale Ale,D.L. Geary Brewing Company Geary's Pale Ale
Pale Ale,Ipswich Ale Brewery Ipswich Original Ale
Pale Ale,Wychwood Brewery Company Ltd WychCraft
Pale Ale,Alltech’s Lexington Brewing and Distilling Co. Kentucky Ale
Pale Ale,Shipyard Brewing Co. Chamberlain Pale Ale
Pale Ale,Christian Moerlein Brewing Company Christian Moerlein Over-The-Rhine Ale
Pale Ale,Ridgeway Brewing Very Bad Elf
Pale Ale,Granville Island Brewery English Bay Pale Ale
Pale Ale,Four Peaks Brewing Company 8th Street Ale
Pale Ale,Whitbread PLC Whitbread Pale Ale
Pale Ale,St. Peter's Brewery Co Ltd St. Peter's English Ale
Pale Ale,Firestone Walker Brewing Co. Unfiltered Double Barrel Ale
Pale Ale,Arcadia Brewing Company Arcadia Angler's Ale
Pale Ale,St. Peter's Brewery Co Ltd St. Peter's Golden Ale
Pale Ale,Wachusett Brewing Company Wachusett Country Pale Ale
Pale Ale,Genesee Brewing Co. / Dundee Brewing Co. Dundee English-Style Ale
Pale Ale,Cucapá Brewing Company Cucapá Chupacabras Pale Ale
Pale Ale,Green Valley Brewing Company (Crooked Creek) Stone Mill Organic Pale Ale
Pale Ale,Mayflower Brewing Company Mayflower Pale Ale
Pale Ale,Heavy Seas Beer Heavy Seas - Pale Ale
Pale Lager,Oskar Blues Grill & Brew Mama's Little Yella Pils
Pale Lager,Lagunitas Brewing Company Lagunitas PILS (Czech Style Pilsner)
Pale Lager,Pivovary Staropramen Staropramen Lager
Pale Lager,Great Lakes Brewing Company Great Lakes The Wright Pils
Pale Lager,Great Divide Brewing Company Nomad
Pale Lager,Pivovar Zlaty Bazant a.s. Golden Pheasant
Pale Lager,Foothills Brewing Company Torch Pilsner
Pale Lager,Steam Whistle Brewing Steam Whistle Pilsner
Pale Lager,Královský Pivovar Krušovice a.s. Krušovice Imperial
Pale Lager,Gordon Biersch Brewery Restaurant Gordon Biersch Czech Style Pilsner
Pale Lager,Cisco Brewers Inc. Summer Of Lager
Pale Lager,Live Oak Brewing Company Live Oak Pilz
Pale Lager,Moonlight Brewing Company Reality Czeck
Pale Lager,Spoetzl Brewery Shiner 101 Czech Style Pilsner
Pale Lager,Trader Joe's Brewing Company Trader Joe's Bohemian Lager
Pale Lager,Trader Joe's Brewing Company Josephs Brau PLZNR Czech-Style Lager
Pale Lager,Notch Brewing Notch Session Pils
Pale Lager,Matt Brewing Company Saranac Bohemian Pilsener
Pale Lager,Short's Brewing Company Short's Pontius Road Pilsner
Pale Lager,Red Hare Brewing Company Long Day Lager
Pale Lager,Grupo Modelo S.A. de C.V. Montejo
Pale Lager,Žatecký Pivovar Žatec
Pale Lager,Terrapin Beer Company Terrapin Sound Czech
Pale Lager,Creemore Springs Brewery Limited Creemore Springs Traditional Pilsner
Pale Lager,Pivovar Velké Popovice a.s. Kozel
Pale Lager,Hopworks Urban Brewery HUB Lager
Pale Lager,Moat Mountain Smoke House & Brewing Co. Moat Czech Pilsner
Pale Lager,Greenpoint Beerworks / Kelso of Brooklyn Kelso Pilsner
Pale Lager,Heater Allen Brewing Pils
Pale Lager,Victory Brewing Company Prima Pils
Pale Lager,Boston Beer Company (Samuel Adams) Samuel Adams Noble Pils
Pale Lager,Brauerei Beck & Co. Beck's
Pale Lager,North Coast Brewing Co. Scrimshaw Pilsner
Pale Lager,Bitburger Brauerei Bitburger Premium Pils
Pale Lager,Sixpoint Brewery Sehr Crisp Pilsner
Pale Lager,Tröegs Brewing Company Tröegs Sunshine Pils
Pale Lager,"Cervecería Cuauhtémoc Moctezuma, S.A. de C.V. Bohemia Clásica"
Pale Lager,Radeberger Exportbierbrauerei Radeberger Pilsner
Pale Lager,Brooklyn Brewery Brooklyn Pilsner
Pale Lager,Matt Brewing Company Saranac Adirondack Lager
Pale Lager,Friesisches Brauhaus zu Jever GmbH & Co KG Jever Pilsener
Pale Lager,König-Brauerei GmbH König Pilsener
Pale Lager,Sly Fox Brewing Company Pikeland Pils
Pale Lager,Bayerische Staatsbrauerei Weihenstephan Weihenstephaner Pilsner
Pale Lager,Stoudts Brewing Co. Stoudts Pils
Pale Lager,Trumer Brauerei Berkeley Trumer Pils
Pale Lager,Krombacher Brauerei Krombacher Pils
Pale Lager,Stieglbrauerei zu Salzburg GmbH Stiegl Pils
Pale Lager,Badische Staatsbrauerei Rothaus AG Rothaus Pils Tannen Zäpfle
Pale Lager,Abita Brewing Co. SOS (Save Our Shore)
Pale Lager,Saint Arnold Brewing Company Saint Arnold Summer Pils
Pale Lager,Wernesgrüner Brauerei AG Wernesgruner
Pale Lager,Brauerei C. & A. Veltins GmbH & Co. Veltins Pilsner
Pale Lager,Brauerei Pinkus Mueller Organic Ur Pils
Pale Lager,Real Ale Brewing Company Hans' Pils
Pale Lager,Paulaner Brauerei GmbH & Co. KG Paulaner Premium Pils
Pale Lager,New England Brewing Co. Elm City Lager
Pale Lager,Kulmbacher Brauerei AG EKU Pils
Pale Lager,Flensburger Brauerei GmbH Und Co. KG Flensburger Pilsener
Pale Lager,Dinkelacker-Schwabenbraeu AG Dinkel Acker Cd-Pils
Pale Lager,Austin Beerworks Pearl Snap Pils
Pale Lager,Minhas Craft Brewery Simpler Times Pilsner
Pale Lager,New Glarus Brewing Company Home Town Blonde
Pale Lager,Brasserie Almaza S.A.L. Almaza Pilsner Beer
Pale Lager,Victory Brewing Company Braumeister Pils
Pale Lager,Hofbrauhaus Wolters GmbH Wolters Pilsener Premium
Pale Lager,Kulmbacher Brauerei AG Kulmbacher Edelherb Premium Pils
Pale Lager,Dogfish Head Brewery My Antonia
Pale Lager,Southern Tier Brewing Company Krampus (Imperial Helles Lager)
Pale Lager,Boston Beer Company (Samuel Adams) Samuel Adams Hallertau Imperial Pilsner
Pale Lager,Rogue Ales Morimoto Imperial Pilsner
Pale Lager,Short's Brewing Company Imperial Spruce India Pilsner
Pale Lager,Three Floyds Brewing Co. & Brewpub Evil Power
Pale Lager,Uinta Brewing Company Tilted Smile Imperial Pilsner
Pale Lager,Mikkeller ApS Draft Bear
Pale Lager,Breckenridge Brewery Regal Pilsner
Pale Lager,Short's Brewing Company Short's The Curl
Pale Lager,Kiuchi Brewery Hitachino Nipponia
Pale Lager,Thomas Creek Brewery OBP Squared (Orange Blossom Pilsner Squared)
Pale Lager,Rahr & Sons Brewing Company Pecker Wrecker
Pale Lager,Blue Mountain Brewery überPils
Pale Lager,Element Brewing Company Summer Pilsner Fusion
Pale Lager,Karl Strauss Brewing Company Whistler Imperial Pils
