style_simple,full_name
Pale Lager,Atwater Block Brewery Uber Ursa Pils
Pale Lager,New Albanian Brewing Company - Pizzeria and Public House Elsa Von Horizon
Pale Lager,Epic Brewing Company Epic Lager
Porter,Great Lakes Brewing Company Coffee Infused Edmund Fitzgerald Porter
Porter,Deschutes Brewery Black Butte Porter
Porter,Breckenridge Brewery Vanilla Porter
Porter,Anchor Brewing Company Anchor Porter
Porter,Sierra Nevada Brewing Co. Sierra Nevada Porter
Porter,Rogue Ales Mocha Porter
Porter,Hill Farmstead Brewery Everett Robust Porter
Porter,Boston Beer Company (Samuel Adams) Samuel Adams Holiday Porter
Porter,Maui Brewing Co. CoCoNut Porter
Porter,Three Floyds Brewing Co. & Brewpub Alpha Klaus Christmas (Xmas) Porter
Porter,Kona Brewing Co. Pipeline Porter
Porter,Atwater Block Brewery Atwater Vanilla Java Porter
Porter,Highland Brewing Highland Oatmeal Porter
Porter,Odell Brewing Company Odell Cutthroat Pale Ale
Porter,Mississippi Brewing Co. Mississippi Mud Black & Tan
Porter,Tröegs Brewing Company Tröegs Dead Reckoning Porter
Porter,Hill Farmstead Brewery Twilight Of The Idols
Porter,Berkshire Brewing Company Inc. Coffeehouse Porter
Porter,Ballast Point Brewing Company Black Marlin Porter
Porter,Flying Dog Brewery Road Dog Porter
Porter,Avery Brewing Company New World Porter
Porter,Southern Tier Brewing Company Porter
Porter,Thirsty Dog Brewing Company Old Leghumper
Porter,Central Waters Brewing Company Mudpuppy Porter
Porter,Matt Brewing Company Saranac Caramel Porter
Porter,(512) Brewing Company (512) Pecan Porter
Porter,Matt Brewing Company Saranac Black & Tan
Porter,Midnight Sun Brewing Co. TREAT (Imperial Chocolate Pumpkin Porter)
Porter,Summit Brewing Company Summit Great Northern Porter
Porter,The Duck-Rabbit Craft Brewery Duck-Rabbit Porter
Porter,Utah Brewers Cooperative Wasatch Polygamy Porter
Porter,Real Ale Brewing Company Shade Grown Coffee Porter
Porter,Highland Brewing Highland Thunderstruck Coffee Porter
Porter,DC Brau Brewing Co. Penn Quarter Porter
Porter,Port City Brewing Porter
Porter,NoDa Brewing Company Coco Loco
Porter,Smuttynose Brewing Company Smuttynose Baltic Porter (Big Beer Series)
Porter,Arcadia Brewing Company Arcadia Shipwreck Porter
Porter,Baltika Breweries Baltika #6 Porter
Porter,The Duck-Rabbit Craft Brewery Duck-Rabbit Baltic Porter
Porter,Surly Brewing Company Smoke
Porter,Oy Sinebrychoff Ab Sinebrychoff Porter
Porter,BOSS Browar Witnica S.A. Black Boss Porter
Porter,"Carlsberg Sverige AB Carnegie Porter 5,5%"
Porter,Three Floyds Brewing Co. & Brewpub Topless Wytch
Porter,Les Trois Mousquetaires Les Trois Mousquetaires Porter Baltique
Porter,Nøgne Ø - Det Kompromissløse Bryggeri A/S Porter
Porter,Great Divide Brewing Company Smoked Baltic Porter
Porter,Southampton Publick House Southampton Imperial Baltic Porter
Porter,Deep Ellum Brewing Company Double Brown Stout
Porter,Foothills Brewing Company Foothills Baltic Porter
Porter,Brouwerij De Molen Tsarina Esra Reserva
Porter,Utenos Alus Porter
Porter,Aldaris Porteris
Porter,Devils Backbone Brewing Company Danzig Baltic Porter
Porter,Beer Here Mørke - Pumpernickel Porter
Porter,HaandBryggeriet Akevitt Porter (Barrel-Aged Porter)
Porter,Atwater Block Brewery Atwater Bourbon Barrel Aged Shaman's Porter
Porter,Uncommon Brewers Baltic Porter
Porter,Browar Amber Grand Imperial Porter
Porter,Baird Brewing Company / Fishmarket Taproom Kurofune Porter
Porter,Hill Farmstead Brewery Fear And Trembling (Cabernet/Bourbon Blend)
Porter,BrewDog Alice Porter
Porter,Brouwerij Sterkens N.V. Hoogstraten Poorter
Porter,Thisted Bryghus Limfjordsporter
Porter,Fuller Smith & Turner PLC Fuller's London Porter
Porter,Harviestoun Brewery Ltd. Old Engine Oil
Porter,Boulevard Brewing Co. Bully! Porter
Porter,Boston Beer Company (Samuel Adams) Samuel Adams Honey Porter
Porter,Foothills Brewing Company People's Porter
Porter,Yards Brewing Co. General Washington's Tavern Porter
Porter,Mayflower Brewing Company Mayflower Porter
Porter,St. Peter's Brewery Co Ltd St. Peter's Old-Style Porter
Porter,Meantime Brewing Company Limited Coffee Porter
Porter,Brouwerij Drie Fonteinen Zwet.Be
Porter,Ridgeway Brewing Santa's Butt
Porter,Meantime Brewing Company Limited London Porter
Porter,Starr Hill Brewery Box Car Pumpkin Porter
Porter,Green Man Brewery Green Man Porter
Porter,Yazoo Brewing Company Sly Rye Porter
Porter,Short's Brewing Company Short's Publican Porter (Imperial London Porter)
Porter,D.L. Geary Brewing Company Geary's London Style Porter
Porter,Darwin Brewery Ltd. Original Flag Porter
Porter,Greenport Harbor Brewing Company Black Duck Porter
Porter,Federal Jack's Restaurant & Brew Pub Kennebunkport Porter
Porter,Ale Asylum Contorter
Porter,Salopian Brewing Company Ltd Entire Butt English Porter
Porter,"St. George Brewing Company, The Porter"
Porter,Cooperstown Brewing Company Benchwarmer Porter
Porter,Wychwood Brewery Company Ltd Black Wych
Porter,Mill Street Brew Pub Mill Street Vanilla Porter
Porter,Nethergate Brewery Co. Ltd. Old Growler
Porter,Shipyard Brewing Co. Longfellow Winter Ale
Porter,Molson Coors Canada Rickard's Dark
Porter,Lancaster Brewing Company Porter
Porter,"Middle Ages Brewing Co., Ltd. Duke Of Winship"
Porter,Williams Brothers Brewing Company Midnight Sun
Porter,Phillips Brewing Company Longboat Double Chocolate Porter
Porter,Big Woods Brewing Co. Busted Knuckle Red Ale
Porter,RCH Brewery Old Slug Porter
Porter,Harvest Moon Brewery Pigs Ass Porter
Porter,French Broad Brewing Co. Anvil Porter
Porter,Ballast Point Brewing Company Victory At Sea Coffee Vanilla Imperial Porter
Porter,Flying Dog Brewery Gonzo Imperial Porter
Porter,Hill Farmstead Brewery Birth Of Tragedy
Porter,Flying Dog Brewery Barrel-Aged Gonzo Imperial Porter
Porter,Caldera Brewing Company Mogli
Porter,Tyranena Brewing Company The Devil Made Me Do It! Coffee Imperial Oatmeal Porter
Porter,Tyranena Brewing Company Dirty Old Man Imperial Rye Porter
Porter,Great Lakes Brewing Company Great Lakes Alberta Clipper
Porter,Tyranena Brewing Company Devil Over A Barrel - Bourbon Barrel-Aged Coffee Imperial Oatmeal Porter
Porter,Evil Twin Brewing Evil Twin Yang
Porter,(512) Brewing Company (512) Whiskey Barrel Aged Double Pecan Porter
Porter,Two Brothers Brewing Company Red Eye Coffee Porter
Porter,Hill Farmstead Brewery Everett (Barrel Aged)
Porter,Ballast Point Brewing Company Victory At Sea (Barrel Aged) Imperial Porter
Porter,Short's Brewing Company Bourbon Black Cherry Porter
Porter,Southampton Publick House Southampton Imperial Porter
Porter,Laughing Dog Brewing Anubis Imperial Coffee Porter
Porter,Shipyard Brewing Co. Shipyard Imperial Porter (Pugsley's Signature Series)
Porter,Clown Shoes Pecan Pie Porter
Porter,To Øl Black Ball Porter
Porter,Founders Brewing Company Founders Porter
Porter,Smuttynose Brewing Company Smuttynose Robust Porter
Porter,Einstök Ölgerð Icelandic Toasted Porter
Porter,Foothills Brewing Company Barrel Aged Peoples' Porter
Porter,Dark Horse Brewing Company Dark Horse Thirsty Trout Porter
Porter,Tyranena Brewing Company Chief BlackHawk Porter
Porter,Speakeasy Ales & Lagers Payback Porter
Porter,Big Sky Brewing Company Bobo's Robust Porter
Porter,Drake's Brewing Co. Drake's Black Robusto Porter
Porter,Crow Peak Brewing Pile O' Dirt Porter
Porter,Kuhnhenn Brewing Company Kuhnhenn Penetration Porter
Porter,Coop Ale Works Gran-Sport Porter
Porter,Great Dane Pub & Brewing Company (Downtown) Black Earth Porter
Porter,Zero Gravity Craft Brewery / American Flatbread Black Cat Porter
Porter,Bridge Road Brewers Robust Porter
Porter,Emmett's Brewing Company Robust Porter
Porter,Stone Brewing Co. Stone Smoked Porter
Porter,Alaskan Brewing Co. Alaskan Smoked Porter
Porter,O'Fallon Brewery Smoke (Smoked Porter)
Porter,Arcadia Brewing Company Arcadia London Porter
Porter,Tyranena Brewing Company Benji's Chipotle Smoked Imperial Porter
Porter,Captain Lawrence Brewing Co. Pleasantville Smoked Porter
Porter,Ranger Creek Brewing & Distilling Mesquite Smoked Porter - MSP
Porter,Brouwerij Van Viven Viven Porter
Porter,Grey Sail Brewing of Rhode Island Leaning Chimney Porter
Porter,8 Wired Brewing Co. The Big Smoke
Porter,East End Brewing Company Smokestack Heritage Porter
Porter,Swamp Head Brewery & Tasting Room Smoke Signal
Porter,Rock Art Brewery Double Porter Smoked
Porter,Fat Heads Brewery & Saloon Up In Smoke Smoked Porter
Porter,Choc Beer Co. / Pete's Place Smoked Porter
Porter,Throwback Brewery Throwback Campfire Smoked Porter
Porter,Bristol Brewing Company Smokebrush Porter
Porter,The Vermont Pub & Brewery Vermont Smoked Porter
Porter,Great Lakes Brewing Company Great Lakes Big Black Smoke
Porter,Spring House Brewing Company Smoked Porter
Porter,Feral Brewing Co. Smoked Porter
Porter,Moat Mountain Smoke House & Brewing Co. Moat Smoke House Porter
Porter,"Middle Ages Brewing Co., Ltd. Smoked Porter"
Porter,"COAST Brewing Company Porter, Smoked"
Porter,Captain Lawrence Brewing Co. Imperial Smoked Porter
Porter,Davidson Brothers Restaurant & Brewery Smoked Porter
Specialty,Southern Tier Brewing Company Pumking
Specialty,Dogfish Head Brewery Punkin Ale
Specialty,Shipyard Brewing Co. Pumpkinhead Ale
Specialty,Weyerbacher Brewing Co. Imperial Pumpkin Ale
Specialty,Boston Beer Company (Samuel Adams) Samuel Adams Harvest Pumpkin Ale
Specialty,Brooklyn Brewery Post Road Pumpkin Ale
Specialty,Smuttynose Brewing Company Smuttynose Pumpkin Ale
Specialty,Shipyard Brewing Co. Shipyard Smashed Pumpkin (Pugsley's Signature Series)
Specialty,New Holland Brewing Company New Holland Ichabod Ale
Specialty,Avery Brewing Company Rumpkin
Specialty,Cigar City Brewing Good Gourd Imperial Pumpkin Ale
Specialty,Elysian Brewing Company Night Owl Pumpkin Ale
Specialty,Buffalo Bill's Brewery Buffalo Bill's Pumpkin Ale
Specialty,Matt Brewing Company Saranac Pumpkin Ale
Specialty,Harpoon Brewery UFO Pumpkin
Specialty,Saint Arnold Brewing Company Pumpkinator
Specialty,Jolly Pumpkin Artisan Ales La Parcela
Specialty,Heavy Seas Beer Heavy Seas - The Great Pumpkin
Specialty,Elysian Brewing Company The Great Pumpkin
Specialty,Hoppin' Frog Brewery Frog's Hollow Double Pumpkin Ale
Specialty,Elysian Brewing Company Dark O' The Moon
Specialty,Cisco Brewers Inc. Pumple Drumkin Spiced Ale
Specialty,Flying Dog Brewery The Fear
Specialty,O'Fallon Brewery Pumpkin Ale
Specialty,Southampton Publick House Southampton Pumpkin Ale
Specialty,Cape Ann Brewing Company Fisherman's Pumpkin Stout
Specialty,Southern Tier Brewing Company Oak Aged Pumking
Specialty,Fat Heads Brewery & Saloon Spooky Tooth Imperial Pumpkin
Specialty,River Horse Brewing Co. Hipp-O-Lantern
Specialty,Blue Point Brewing Company Blue Point's Mother Pumpkin Ale
Strong Ale,Brouwerij St. Bernardus NV St. Bernardus Abt 12
Strong Ale,Brasserie de Rochefort Trappistes Rochefort 10
Strong Ale,Brewery Ommegang Three Philosophers Belgian Style Blend (Quadrupel)
Strong Ale,Brouwerij Westvleteren (Sint-Sixtusabdij van Westvleteren) Trappist Westvleteren 12
Strong Ale,Boulevard Brewing Co. The Sixth Glass
Strong Ale,Firestone Walker Brewing Co. Sticky Monkey
Strong Ale,Boulevard Brewing Co. Bourbon Barrel Quad (BBQ)
Strong Ale,Bierbrouwerij De Koningshoeven B.V. La Trappe Quadrupel (Koningshoeven / Dominus)
Strong Ale,De Struise Brouwers Pannepot
Strong Ale,Brouwerij St. Bernardus NV Christmas Ale
Strong Ale,Unibroue La Terrible
Strong Ale,Avery Brewing Company The Reverend
Strong Ale,Victory Brewing Company V-Twelve
Strong Ale,Brouwerij Van Steenberge N.V. Gulden Draak Quad
Strong Ale,Weyerbacher Brewing Co. Quad
Strong Ale,De Struise Brouwers Pannepot Reserva
Strong Ale,The Lost Abbey Judgment Day
Strong Ale,Brouwerij Van Honsebrouck N.V. Kasteel Rouge
Strong Ale,Weyerbacher Brewing Co. Blasphemy
Strong Ale,Brouwerij Van Honsebrouck N.V. Kasteel Donker
Strong Ale,Brouwerij Straffe Hendrik / Huisbrouwerij De Halve Maan Straffe Hendrik Quadrupel
Strong Ale,Brasserie Dieu Du Ciel Rigor Mortis ABT
Strong Ale,Smuttynose Brewing Company Smuttynose Gravitation (Big Beer Series)
Strong Ale,Bierbrouwerij De Koningshoeven B.V. La Trappe Quadrupel Barrique (Oak Aged)
Strong Ale,De Leyerth Brouwerijen (Urthel) Urthel Samaranth
Strong Ale,Brouwerij Van Honsebrouck N.V. Kasteel Cuvée Du Chateau
Strong Ale,Brouwerij De Landtsheer NV Malheur 12°
Strong Ale,Brasserie de l'Abbaye du Val-Dieu Val-Dieu Grand Cru
Strong Ale,De Struise Brouwers St. Amatus 12
Strong Ale,Charleville Vineyard Microbrewery Box Of Chocolate
Strong Ale,Sly Fox Brewing Company Ichor
Strong Ale,Arcense Stoombierbouwerij (Hertog Jan Brouwerij) Hertog Jan Grand Prestige
Strong Ale,Brouwerij Smisje 't Smisje BBBourgondier
Strong Ale,Brewery Ommegang Bourbon Barrel Aged Three Philosophers
Dark Lager,New Belgium Brewing Fat Tire Amber Ale
Dark Lager,Tröegs Brewing Company Tröegs Hopback Amber Ale
Dark Lager,Lagunitas Brewing Company Censored
Dark Lager,Bear Republic Brewing Co. Red Rocket Ale
Dark Lager,Maine Beer Company Zoe
Dark Lager,Rogue Ales Santa's Private Reserve Ale
Dark Lager,North Coast Brewing Co. Ruedrich's Red Seal Ale
Dark Lager,Anderson Valley Brewing Company Boont Amber Ale
Dark Lager,Cigar City Brewing Tocobaga Red Ale
Dark Lager,Highland Brewing Highland Gaelic Ale
Dark Lager,Rogue Ales American Amber Ale
Dark Lager,Breckenridge Brewery Avalanche Ale
Dark Lager,Ithaca Beer Company Cascazilla
Dark Lager,Rogue Ales St. Rogue Red
Dark Lager,Speakeasy Ales & Lagers Prohibition Ale
Dark Lager,Mendocino Brewing Company Red Tail Ale
Dark Lager,Switchback Brewing Company Switchback Ale
Dark Lager,"Lakefront Brewery, Inc. Fixed Gear"
Dark Lager,BrewDog 5 A.M. Saint
Dark Lager,Rogue Ales Captain Sig's Northwestern Ale
Dark Lager,AleSmith Brewing Company AleSmith My Bloody Valentine
Dark Lager,Ale Asylum Ambergeddon
Dark Lager,AleSmith Brewing Company AleSmith Evil Dead Red
Dark Lager,Coronado Brewing Company Mermaid's Red Ale
Dark Lager,The Bruery Loakal Red
Dark Lager,The Duck-Rabbit Craft Brewery Duck-Rabbit Amber Ale
Dark Lager,Ninkasi Brewing Company Believer
Dark Lager,Saint Arnold Brewing Company Saint Arnold Amber Ale
Dark Lager,Mad River Brewing Company Jamaica Red Ale
Dark Lager,Local Option Morning Wood
Dark Lager,Boston Beer Company (Samuel Adams) Samuel Adams Mighty Oak Ale
Dark Lager,New Glarus Brewing Company Snowshoe Red Ale
Dark Lager,Brewery Vivant Big Red Coq
Strong Ale,Tröegs Brewing Company Tröegs Nugget Nectar
Strong Ale,Oskar Blues Grill & Brew G'Knight Imperial Red Ale
Strong Ale,Green Flash Brewing Co. Green Flash Hop Head Red Ale
Strong Ale,Lagunitas Brewing Company Lagunitas Lucky 13 Mondo Large Red Ale
Strong Ale,Great Lakes Brewing Company Great Lakes Nosferatu
Strong Ale,Ballast Point Brewing Company Tongue Buckler - Imperial Red Ale
Strong Ale,Grand Teton Brewing Co. Pursuit Of Hoppiness
Strong Ale,Short's Brewing Company Aorta Ale (Double Red Ale)
Strong Ale,Mad River Brewing Company Double Dread Imperial Red Ale
Strong Ale,Peak Organic Brewing Company King Crimson
Strong Ale,Upland Brewing Company Ard Ri
Strong Ale,New Albanian Brewing Company - Pizzeria and Public House Elector Imperial Red Ale
Strong Ale,Odell Brewing Company Odell Extra Special Red Ale
Strong Ale,Iron Horse Brewery Double Rainbow Ale
Strong Ale,Marble Brewery Imperial Red Ale
Strong Ale,Grand Teton Brewing Co. Bone Warmer Amber Ale
Strong Ale,Lavery Brewing Company Lavery Imperial Red Ale
Strong Ale,Columbus Brewing Company Columbus Uncle Rusty
Pale Lager,Austin Beerworks Battle Axe
Pale Ale,Guinness Ltd. Smithwick's
Pale Ale,Boston Beer Company (Samuel Adams) Samuel Adams Irish Red
Pale Ale,Great Lakes Brewing Company Great Lakes Conway's Irish Ale
Pale Ale,Smithwick's Brewery / Irish Ale Breweries Ltd Smithwick's Ale
Pale Ale,Guinness Ltd. Kilkenny Irish Cream Ale
Pale Ale,Murphy Brewery Ireland Limited Murphy's Irish Red Beer
Pale Ale,Boulevard Brewing Co. Irish Ale
Pale Ale,Karl Strauss Brewing Company Red Trolley Ale
Pale Ale,Carlow Brewing Company O'Hara's Irish Red
Pale Ale,Boston Beer Company (Samuel Adams) Samuel Adams Brick Red
Pale Ale,Short's Brewing Company Short's The Magician
Pale Ale,Matt Brewing Company Saranac Irish Red Ale
Pale Ale,Pabst Brewing Company McSorley's Irish Pale Ale
Pale Ale,Alpine Beer Company McIlhenney's Irish Red
Pale Ale,Thomas Creek Brewery River Falls Red Ale
Pale Ale,Thomas Hooker Brewing Company Thomas Hooker Irish Style Red Ale
Pale Ale,Casco Bay Brewing Co. Casco Bay RipTide Red Ale
Pale Ale,BJ's Chicago Pizza & Brewery Inc. BJ's Jeremiah Red Ale
Pale Ale,Moylan's Brewery Danny's Irish Style Red Ale
Pale Ale,Aviator Brewing Company HotRod Red
Pale Ale,Starr Hill Brewery Starr Hill Amber Ale
Pale Ale,The Porterhouse Brewing Company Porterhouse Red
Pale Ale,North Country Brewing Station 33 Firehouse Red
Pale Ale,Flying Bison Brewing Company Aviator Red
Pale Ale,Thomas Caffrey Brewing Co. Caffrey's Irish Ale
Pale Ale,Tighthead Brewing Company Scarlet Fire
Pale Ale,Smoky Mountain Brewery & Restaurant Cherokee Red Ale
Pale Ale,Thirsty Dog Brewing Company Irish Setter Red
Pale Ale,BJ's Restaurant & Brewhouse Jeremiah Red Ale
Pale Ale,Dragonmead Microbrewery Dragonmead Erik The Red
Pale Ale,Long Ireland Beer Company Celtic Ale
Pale Ale,Rock Bottom Restaurant & Brewery Fire Chief Ale
Pale Ale,Wachusett Brewing Company Quinn's Amber Ale
Pale Ale,Dunedin Brewery Red Head Red Ale
Pale Ale,Franciscan Well Micro Brewery Rebel Red
Pale Ale,Garrison Brewing Company Irish Red Ale
Pale Ale,Sly Fox Brewing Company Seamus' Irish Red Ale
Pale Ale,"Titletown Brewing Company Johnny ""Blood"" McNally Red Ale"
Specialty,Founders Brewing Company Founders Red's Rye PA
Specialty,Sierra Nevada Brewing Co. Sierra Nevada Ruthless Rye IPA
Specialty,Bear Republic Brewing Co. Hop Rod Rye
Specialty,Boulevard Brewing Co. Rye-on-Rye
Specialty,Two Brothers Brewing Company Cane & Ebel
Specialty,Brasserie Dieu Du Ciel Route Des Épices (Ale Rousse Au Poivre)
Specialty,Real Ale Brewing Company Full Moon Pale Rye Ale
Specialty,Arcadia Brewing Company Arcadia Sky High Rye
Specialty,Blue Point Brewing Company Blue Point Rastafa Rye Ale
Specialty,Boston Beer Company (Samuel Adams) Samuel Adams Revolutionary Rye Ale
Specialty,Upright Brewing Company Six (#6)
Specialty,New Holland Brewing Company Rye P.A. Hatter
Specialty,Rising Tide Brewing Company Daymark
Specialty,Lawson's Finest Liquids Permagrin Rye Pale Ale
Specialty,Boulevard Brewing Co. Westside Rye
Specialty,Mayflower Brewing Company Summer Rye
Specialty,Dock Street Brewery & Restaurant Rye IPA
Specialty,Madison River Brewing Company Salmon Fly Honey Rye
Specialty,Black Market Brewing Co. Rye IPA
Specialty,The Bronx Brewery Pale Ale
Specialty,Telluride Brewing Co. Bridal Veil Rye Pale Ale
Dark Ale,Live Oak Brewing Company Live Oak Roggenbier
Dark Ale,Mill Street Brew Pub Mill Street Schleimhammer Roggenbier
Dark Ale,Stiftsbrauerei Schlägl Schlägl Bio-Roggen
Dark Ale,Thurn Und Taxis Regensburg Gmbh Fürstliche Brauerei Thurn Und Taxis Roggen
Dark Ale,Brauerei Schrems Schremser Roggen Bier
Dark Ale,Beaver Brewing Company Roggenator
Dark Ale,Real Ale Brewing Company Roggenbier
Dark Ale,Vintage Brewing Company Tippy Toboggon
Dark Ale,Iron Hill Brewery & Restaurant Roggenbier
Dark Ale,Sweetwater Tavern & Brewery Crazy Jackass Ale
Dark Ale,The Bier Brewery Roggenschnizzle
Dark Ale,Real Ale Brewing Company Dunkelroggen
Dark Ale,Brasserie Dieu Du Ciel Barbarossa
Dark Ale,Browar Kormoran Orkiszowe
Dark Ale,Taps Fish House & Brewery Roggen
Dark Ale,Iron Hill Brewery & Restaurant Rye Halladay
Strong Ale,Founders Brewing Company Founders Backwoods Bastard
Strong Ale,Founders Brewing Company Founders Dirty Bastard
Strong Ale,Oskar Blues Grill & Brew Old Chub - Scottish Style Ale
Strong Ale,Orkney Brewery SkullSplitter
Strong Ale,Dark Horse Brewing Company Dark Horse Scotty Karate Scotch Ale
Strong Ale,Great Divide Brewing Company Claymore Scotch Ale
Strong Ale,Innis & Gunn Rum Cask Oak Aged Beer
Strong Ale,AleSmith Brewing Company AleSmith Wee Heavy
Strong Ale,Traquair House Brewery Lld Traquair House Ale
Strong Ale,Boston Beer Company (Samuel Adams) Samuel Adams Scotch Ale
Strong Ale,Belhaven Brewery Company Ltd. Wee Heavy
Strong Ale,Traquair House Brewery Lld Traquair Jacobite
Strong Ale,Moylan's Brewery Kilt Lifter Scotch Ale
Strong Ale,Cigar City Brewing Big Sound Scotch Ale
Strong Ale,Boston Beer Company (Samuel Adams) Samuel Adams Wee Heavy (Imperial Series)
Strong Ale,Magic Hat Brewing Company Jinx
Strong Ale,Brasserie Dieu Du Ciel Équinoxe Du Printemps
Strong Ale,Smuttynose Brewing Company Smuttynose Scotch Style Ale (Big Beer Series)
Strong Ale,The Duck-Rabbit Craft Brewery Duck-Rabbit Wee Heavy Scotch Style Ale
Strong Ale,Brasserie de Silly S.A. Scotch Silly
Strong Ale,AleSmith Brewing Company AleSmith Wee Heavy - Barrel Aged
Strong Ale,Lake Louie Brewery Company Lake Louie Warped Speed Scotch Ale
Strong Ale,Monday Night Brewing Drafty Kilt Scotch Ale
Strong Ale,Rahr & Sons Brewing Company Iron Thistle
Strong Ale,New England Brewing Co. Wet Willy Scotch Ale
Strong Ale,Tyranena Brewing Company Sheep Shagger Scotch Ale
Strong Ale,French Broad Brewing Co. Wee Heavy-er Scotch Style Ale
Strong Ale,Erie Brewing Co. Ol' Red Cease And Desist
Strong Ale,Tyranena Brewing Company Shaggin' In The Wood
Strong Ale,Sierra Nevada Brewing Co. Sierra Nevada Scotch Ale
Strong Ale,Big Sky Brewing Company Heavy Horse Scotch Ale
Strong Ale,Sprecher Brewing Company Pipers Scotch-Style Ale
Strong Ale,Brau Brothers Brewing Co. LLC Bancreagie Peated Scotch Ale
Strong Ale,Lake Louie Brewery Company Louie's Reserve Scotch Ale
Strong Ale,Hoppin' Frog Brewery Outta Kilter
Dark Ale,Three Floyds Brewing Co. & Brewpub Robert The Bruce Scottish Ale
Dark Ale,Belhaven Brewery Company Ltd. Belhaven Scottish Ale
Dark Ale,Odell Brewing Company Oak Aged 90 Shilling
Dark Ale,Innis & Gunn Innis And Gunn Oak Aged Beer
Dark Ale,Brooklyn Brewery Brooklyn Winter Ale
Dark Ale,Four Peaks Brewing Company Kilt Lifter Scottish Style Ale
Dark Ale,Erie Brewing Co. Railbender Ale
Dark Ale,Long Trail Brewing Co. Hibernator
Dark Ale,Sun King Brewing Company Wee Mac Brown
Dark Ale,Orkney Brewery Dark Island
Dark Ale,Ballast Point Brewing Company Pepper Piper Down (Habanero)
Dark Ale,Belhaven Brewery Company Ltd. St. Andrew's Ale
Dark Ale,Appalachian Brewing Company Jolly Scot Scottish Ale
Dark Ale,Bristol Brewing Company Laughing Lab Scottish-Style Ale
Dark Ale,Orkney Brewery The Red MacGregor
Dark Ale,Thirsty Dog Brewing Company Twisted Kilt Scotch Ale
Dark Ale,Empyrean Brewing Company Burning Skye Scottish Ale
Dark Ale,"Inveralmond Brewery Ltd., The Blackfriar"
Dark Ale,Fargo Brewing Company Stone's Throw Scottish Ale
Dark Ale,Orkney Brewery Dark Island Reserve
Dark Ale,The Caledonian Brewing Company Caledonian 80/-
Dark Ale,Pelican Pub & Brewery MacPelican's Scottish Style Ale
Dark Ale,"Inveralmond Brewery Ltd., The Lia Fail"
Dark Ale,Gritty McDuff's Brewing Company Gritty McDuff's Scottish Ale
Dark Ale,Broughton Ales Ltd Black Douglas Ale
Dark Ale,Keweenaw Brewing Company Olde Ore Dock Scottish Ale
Dark Ale,Ballast Point Brewing Company Piper Down Scottish Ale (Bourbon Barrel Aged)
Dark Ale,Williams Brothers Brewing Company 80/- (Eighty Shilling)
Dark Ale,Fearless Brewing Company Scottish Ale
Dark Ale,Florida Beer Company Hog's Head Brew (Harry Potter)
Dark Ale,Sun King Brewing Company Java Mac
Dark Ale,Sheepscot Valley Brewing Company Pemaquid Ale
Dark Ale,Shoreline Brewery And Restaurant Beltaine Scottish Ale
Dark Ale,Isle Of Skye Brewery Black Cuillin
Porter,Dark Horse Brewing Company Dark Horse Fore Smoked Stout
Porter,Yazoo Brewing Company Sue
Porter,The Bruery Smoking Wood Rye Barrel Aged
Porter,Evil Twin Brewing Evil Twin Ashtray Heart
Porter,HaandBryggeriet Norwegian Wood
Porter,Nøgne Ø - Det Kompromissløse Bryggeri A/S Sunturnbrew
Porter,New Holland Brewing Company Charkoota Rye
Porter,Hill Farmstead Brewery Holger Danske
Porter,Brouwerij De Molen Hemel & Aarde
Porter,Midnight Sun Brewing Co. Bar Fly
Porter,Three Floyds Brewing Co. & Brewpub Ham On Rye
Porter,Professor Fritz Briem Professor Fritz Briem Grodziskie
Porter,"Brouwerij De Molen Bloed, Zweet & Tranen"
Porter,Bayou Teche Brewery LA-31 Boucanèe
Porter,Brouwerij De Molen Rook & Vuur
Porter,Brasserie Dieu Du Ciel Charbonniere
Porter,White Birch Brewing White Birch Tavern Ale
Porter,Brasseurs Illimités Simple Malt Double Porter
Porter,Brasserie Fischer / Fischer Biere d' Alsace Adelscott
Porter,the Nils Oscar Company Nils Oscar Rökporter
Porter,Yeastie Boys Rex Attitude
Porter,Fullsteam Brewery Hogwash!
Porter,Brouwerij De Dochter van de Korenaar Bravoure
Porter,Jackie O's Pub & Brewery Hogwash
Porter,Flying Dog Brewery Backyard Ale
Porter,Crown Valley Brewing & Distilling Co. Black Cabin Smoked Ale
Porter,Bootlegger's Brewery Wild Fire Wheat
Porter,Live Oak Brewing Company Live Oak Oaktoberfest
Wild/Sour,Dogfish Head Brewery Festina Pêche
Wild/Sour,Professor Fritz Briem Professor Fritz Briem 1809 Berliner Weisse
Wild/Sour,Three Floyds Brewing Co. & Brewpub Deesko
Wild/Sour,Bear Republic Brewing Co. Tartare
Wild/Sour,White Birch Brewing White Birch Berliner Weisse
Wild/Sour,Gasthaus & Gosebrauerei Bayerischer Bahnhof Berliner Style Weisse
Wild/Sour,Ballast Point Brewing Company Sour Wench Blackberry Ale
Wild/Sour,Berliner Kindl Brauerei Berliner Kindl Weisse
Wild/Sour,Jackie O's Pub & Brewery Berliner Weiss
Wild/Sour,Bend Brewing Company Ching Ching
Wild/Sour,New Belgium Brewing La Folie
Wild/Sour,Brouwerij Van Steenberge N.V. Monk's Café Flemish Sour Ale
Wild/Sour,Deschutes Brewery The Dissident
Wild/Sour,Brouwerij Liefmans Goudenband
Wild/Sour,Goose Island Beer Co. Madame Rose
Wild/Sour,Captain Lawrence Brewing Co. Rosso E Marrone
Wild/Sour,Brouwerij Van Honsebrouck N.V. Bacchus
Wild/Sour,HaandBryggeriet Haandbakk
Wild/Sour,Picobrouwerij Alvinne / Den Bierzolder Cuvee Freddy
Wild/Sour,Kuhnhenn Brewing Company Kuhnhenn Cherry Olde Brune
Wild/Sour,De Struise Brouwers Aardmonnik - Earthmonk
Wild/Sour,LoverBeer Madamin
Wild/Sour,Brasserie Trois Dames Grande Dame Oud Bruin
