style_simple,full_name
Pale Ale,Genesee Brewing Co. / Dundee Brewing Co. Dundee Kolsch Style Ale
Pale Ale,Blue Mountain Brewery Kölsch 151
Pale Ale,Uinta Brewing Company HooDoo
Pale Ale,Spoetzl Brewery Shiner Kölsch
Pale Ale,French Broad Brewing Co. Gateway Kolsch
Pale Ale,Berkshire Brewing Company Inc. Gold Spike Ale
Pale Ale,Short's Brewing Company Kolsch 45
Pale Ale,Rock Bottom Restaurant & Brewery Kolsch
Pale Ale,Big Boss Brewing Angry Angel Kolsch
Pale Ale,Trader Joe's Brewing Company Josephs Brau Summer Brew
Pale Ale,Four Peaks Brewing Company Sunbru Kölsch-Style Ale
Specialty,Ochakovo Ochakovskiy Kvass
Specialty,All Stars Bakery Kvas
Specialty,Monastyrskiy Kvas Monastyrskiy Kvas
Specialty,Beaver Brewing Company Kvass
Specialty,Baltika Breweries Khlebny Kray
Specialty,Deka Brewery Nicola
Specialty,Slavutych Brewery Kvas Taras
Specialty,Gubernija Brewery Gubernija Duonos Gira Kvass
Specialty,Monastyrskiy Kvas Monastyrskiy Okroshka Kvas
Specialty,Tempo Beer Industries LTD Nesher Malt
Specialty,Obolon Brewery Obolon Kwas Chlebowy
Specialty,Pivovarinniy Zavod Samko Krushka & Bochka Kvass
Specialty,Monastyrskiy Kvas Monastyrskiy Black Currant Kvas
Specialty,"Darl, Tov Danilo Classic Kvas"
Specialty,"Darl, Tov Danilo Okroshka Kvas"
Specialty,"Darl, Tov Danilo Pohmilny Kvas"
Specialty,Israel Beer Breweries Ltd. Malty
Specialty,Vofas-Engelman Smetonika Gira
Specialty,Borodino ZAO Borodinskiy Kvas
Specialty,Radomyshlskij Pivovarennyj Zavod Drevlyansky Kvass
Specialty,SP Etrus Olimpia Kvas
Lager,Anheuser-Busch Budweiser
Lager,Pabst Brewing Company Pabst Blue Ribbon (PBR)
Lager,Grupo Modelo S.A. de C.V. Corona Extra
Lager,Miller Brewing Co. Miller High Life
Lager,Desnoes & Geddes Limited Red Stripe Jamaican Lager
Lager,Latrobe Brewing Co. Rolling Rock Extra Pale
Lager,"Cervecería Cuauhtémoc Moctezuma, S.A. de C.V. Dos Equis Special Lager"
Lager,Grupo Modelo S.A. de C.V. Modelo Especial
Lager,Miller Brewing Co. Miller Genuine Draft
Lager,Labatt Brewing Company Ltd. Labatt Blue
Lager,Foster's Group Limited Foster's Lager
Lager,"Cervecería Cuauhtémoc Moctezuma, S.A. de C.V. Tecate"
Lager,Margaritaville Brewing Co. Landshark Lager
Lager,Molson Coors Canada Molson Canadian Lager
Lager,Anheuser-Busch Busch Beer
Lager,"Cervecería Cuauhtémoc Moctezuma, S.A. de C.V. Sol"
Lager,Anheuser-Busch Natural Ice
Lager,Narragansett Brewing Co. Narragansett Lager
Lager,Miller Brewing Co. Icehouse
Lager,Coors Brewing Company Batch 19
Lager,Anheuser-Busch Bud Ice
Lager,Hamm's Brewing Co. Hamm's
Lager,Pabst Brewing Company Lone Star Beer
Lager,Pabst Brewing Company Old Milwaukee Beer
Lager,Cerveceria Nacional Dominicana Presidente
Lager,Miller Brewing Co. Milwaukee's Best Dry
Lager,Miller Brewing Co. Red Dog
Lager,Coors Brewing Company Keystone Ice
Lager,Pabst Brewing Company Old Style
Lager,Miller Brewing Co. Milwaukee's Best Ice
Lager,Genesee Brewing Co. / Dundee Brewing Co. Genesee Beer
Lager,Jacob Leinenkugel Brewing Company Leinenkugel's Original
Lager,Pabst Brewing Company Stroh's
Lager,August Schell Brewing Company Grain Belt Premium
Lager,"Cervecería Cuauhtémoc Moctezuma, S.A. de C.V. Carta Blanca"
Lager,Cerveceria Costa Rica Imperial
Lager,Pabst Brewing Company National Bohemian Beer
Lager,Pittsburgh Brewing Co. Iron City Beer
Lager,JOS. Schlitz Brewing Co. (Pabst) Schlitz Gusto (Classic 1960's Formula)
Lager,United Breweries - UB Group Taj Mahal Premium Lager
Lager,Molson Coors Canada Molson Ice
Lager,"Lion Brewery, Inc. Lionshead Pilsner"
Lager,Carib Brewery Limited Carib Lager
Lager,Birra Peroni Industriale S.p.A. Birra Peroni
Lager,UNICER União Cervejeira S.A. Super Bock
Lager,Kona Brewing Co. Longboard Island Lager
Lager,Sapporo Breweries Ltd. Sapporo Premium Beer
Lager,"Kirin Brewery Company, Limited Kirin Ichiban"
Lager,Moosehead Breweries Ltd. Alpine Lager
Lager,New Glarus Brewing Company Totally Naked
Lager,Anheuser-Busch Michelob (Original Lager)
Lager,Spoetzl Brewery Shiner Kosmos Reserve
Lager,Spoetzl Brewery Shiner Blonde
Lager,Molson Coors Canada Molson Golden
Lager,Avery Brewing Company Joe's Premium American Pilsner
Lager,Minhas Craft Brewery Simpler Times Lager
Lager,Blitz-Weinhard Brewing Co. Henry Weinhard's Private Reserve
Lager,Capital Brewery Supper Club Lager
Lager,Ska Brewing Co. Mexican Logger
Lager,Upslope Brewing Company Upslope Craft Lager
Lager,Orange Blossom Pilsner LLC Orange Blossom Pilsner
Lager,Philadelphia Brewing Company Kenzinger
Lager,Abita Brewing Co. Golden
Lager,Tommyknocker Brewery Alpine Glacier Lager
Lager,Sleeman Breweries Ltd. Original Draught
Lager,Cricket Hill Brewing Co. East Coast Lager
Lager,Jacob Leinenkugel Brewing Company Northwoods Lager
Lager,Brooklyn Brewery Brooklyn Lager
Lager,Blue Point Brewing Company Blue Point Toasted Lager
Lager,Abita Brewing Co. Amber
Lager,Genesee Brewing Co. / Dundee Brewing Co. Dundee Original Honey Brown Lager
Lager,"Lakefront Brewery, Inc. Riverwest Stein Beer"
Lager,Magic Hat Brewing Company Vinyl
Lager,Hop City Brewing Co. Barking Squirrel Lager
Lager,Anheuser-Busch Redbridge
Lager,Anheuser-Busch ZiegenBock Amber
Lager,August Schell Brewing Company Grain Belt Nordeast
Lager,Capital Brewery Wisconsin Amber
Lager,Molson Coors Canada Rickard's Red
Lager,Creemore Springs Brewery Limited Creemore Springs Premium Lager
Lager,Red Oak Brewery Red Oak Amber
Lager,Rahr & Sons Brewing Company Rahr's Red Amber Lager
Lager,Stevens Point Brewery Point Classic Amber
Lager,Sleeman Breweries Ltd. Sleeman Honey Brown Lager
Lager,Capital Brewery Winter Skål
Lager,August Schell Brewing Company Schell's Dark
Lager,Starr Hill Brewery Starr Hill Jomo Lager
Lager,AC Golden Brewing Company Colorado Native Lager
Lager,Cape Ann Brewing Company Fisherman's Brew
Lager,Anheuser-Busch Michelob Honey Lager
Lager,Tommyknocker Brewery Ornery Amber
Lager,Lucky Bucket Brewing Co. Pre-Prohibition Style Lager
Lager,Trader Joe's Brewing Company Trader Jose's Dark Lager
Lager,Hudepohl-Schoenling Brewing Co. Amber Lager
Lager,Granville Island Brewery Cypress Honey Lager
Lager,Rochester Mills Beer Co. Rochester Mills Rochester Red
Lager,Olde Hickory Brewery Ruby Lager
Lager,Genesee Brewing Co. / Dundee Brewing Co. Dundee Irish Red Lager
Lager,The Defiant Brewing Company Muddy Creek Lager
Lager,"Lion Brewery, Inc. Stegmaier Amber Lager"
Lager,Indian Wells Brewing Company Mojave Red
Lager,Great Lakes Brewing Company Great Lakes Dortmunder Gold
Lager,Three Floyds Brewing Co. & Brewpub Jinx Proof
Lager,Dortmunder Actien Brauerei / DAB DAB Original
Lager,Baltika Breweries Baltika #7 Export
Lager,Two Brothers Brewing Company Dog Days Dortmunder Style Lager
Lager,VBL Tien Giang Limited (Fosters) 33 Export
Lager,Spoetzl Brewery Shiner Dortmunder
Lager,UAB Švyturys Svyturys Ekstra
Lager,Appalachian Brewing Company Mountain Lager
Lager,Thirsty Dog Brewing Company Labrador Lager
Lager,Great Lakes Brewing Company Great Lakes Imperial Dortmunder
Lager,Sapporo Breweries Ltd. Yebisu (Premium)
Lager,Spoetzl Brewery Shiner Fröst
Lager,Dortmunder Actien Brauerei / DAB DAB Export
Lager,Flensburger Brauerei GmbH Und Co. KG Flensburger Gold
Lager,Gordon Biersch Brewery Restaurant Gordon Biersch Golden Export
Lager,Minneapolis Town Hall Brewery Dortmunder Lager
Lager,Klosterbrauerei Reutberg Reutberger Export Hell
Lager,Aktien-Brauerei Kaufbeuren AG Premium Edel (Spezialbier Edel)
Lager,the Nils Oscar Company Nils Oscar God Lager
Lager,Bürgerbräu Bad Reichenhall Alpen Stoff
Lager,Spendrups Bryggeri AB Mariestads Export
Lager,Depot Street Brewing Loose Caboose Lager
Lager,Herzoglich Bayerisches Brauhaus Tegernsee Tegernsee Spezial
Lager,Kulmbacher Brauerei AG Mönchshof Landbier
Lager,Moonlight Brewing Company Lunatic Lager
Lager,UAB Švyturys Svyturys Ekstra Draught
Lager,Spendrups Bryggeri AB Norrlands Guld Export
Lager,Hansa Brauerei / Namibia Breweries Hansa Imported Dortmunder
Lager,Howe Sound Inn & Brewing Company Lager
Lager,Dortmunder Actien Brauerei / DAB Hansa Export
Lager,Der HirschBrau/Privatbrauerei Höss Allgäuer Hüttenbier
Lager,Lagerheads Smokehouse & Brewing Co. Barnburner Lager
Lager,Bayreuther Bierbrauerei Aktien Original 1857
Lager,Hofbrauhaus Freising Jägerbier Natürtrub Export Hell
Lager,New Belgium Brewing 1554 Enlightened Black Ale
Lager,Guinness Ltd. Guinness Black Lager
Lager,Jacob Leinenkugel Brewing Company Leinenkugel's Creamy Dark
Lager,Heineken Nederland B.V. Heineken Dark Lager
Lager,Baltika Breweries Baltika #4 Original (Dark)
Lager,St. Pauli Brauerei C.L. Wilh. Brandt Gmbh & Co. St. Pauli Girl Special Dark
Lager,Brasserie Fischer / Fischer Biere d' Alsace Fischer Tradition Amber
Lager,Moonlight Brewing Company Death & Taxes Black Beer
Lager,Anadolu Efes Brewery Efes Dark
Lager,Lao Brewery Co. Beerlao Dark
Lager,Short's Brewing Company Black Licorice Lager
Lager,Bernard Family Brewery Bernard Cerne
Lager,"Grupo Cervezas Alhambra, SL Alhambra Negra"
Lager,Greenpoint Beerworks / Kelso of Brooklyn Kelso Nut Brown Lager
Lager,Elevator Brewery & Draught Haus Elevator Dark Horse Lager
Lager,Žatecký Pivovar Žatec Dark Lager
Lager,Royal Unibrew A/S Faxe Amber
Lager,UNICER União Cervejeira S.A. Super Bock Stout
Lager,Notch Brewing Notch Černé Pivo
Lager,Dortmunder Actien Brauerei / DAB DAB Dark Beer
Lager,Sociedade Central de Cervejas Sagres Cerveja Preta (Dark)
Lager,Obolon Brewery Obolon Oksamytove (Deep Velvet)
Lager,U Fleků Pivovaru a Restauraci U Fleku Dark Lager
Lager,Sapporo Breweries Ltd. Yebisu Black Beer
Lager,Pivovary Staropramen Staropramen Granat Prague
Lager,Big Rock Brewery Honey Brown Lager
Lager,Sociedade Central de Cervejas Bohemia
Lager,Pivovar Náchod a.s. Primator Dark Lager
Lager,Asahi Breweries Ltd Asahi Honnama Clear Black
Lager,Cameron's Brewing Co. Dark 266
Lager,Heineken Nederland B.V. Heineken Oud Bruin
Lager,Stella Artois Stella Artois
Lager,Heineken Nederland B.V. Heineken Lager Beer
Lager,Guinness Ltd. Harp Lager
Lager,Birra Peroni Industriale S.p.A. Peroni Nastro Azzurro
Lager,Grolsch Bierbrouwerij N.V. Grolsch Premium Lager
Lager,Carlsberg Danmark A/S Carlsberg Beer
Lager,Brasseries Kronenbourg Kronenbourg 1664
Lager,Birra Moretti (Heineken) Birra Moretti
Lager,"Boon Rawd Brewery Co., Ltd Singha"
Lager,St. Pauli Brauerei C.L. Wilh. Brandt Gmbh & Co. St. Pauli Girl
Lager,Samuel Smith Old Brewery (Tadcaster) Samuel Smith's Pure Brewed Lager Beer
Lager,Asia Pacific Breweries Ltd. Tiger Beer
Lager,Zywiec Breweries PLC (Heineken) Zywiec Beer
Lager,United Breweries - UB Group Kingfisher Premium Lager
Lager,Damm S. A. Estrella Damm
Lager,Mythos Breweries S.A. Mythos Hellenic Lager Beer
Lager,Rogue Ales Kells Irish Style Lager
Lager,Anadolu Efes Brewery Efes Pilsener
Lager,Cervecería y Maltería Quilmes / Grupo Bemberg Quilmes
Lager,New Zealand Breweries Limited Steinlager
Lager,Browar Okocim S.A. (Carlsberg) O.K. Beer
Lager,Baltika Breweries Baltika #3 Classic
Lager,Oranjeboom Bierbrouwerij B. V. Oranjeboom Premium Lager
Lager,Amstel Brouwerij B. V. Amstel Lager
Lager,Sapporo Breweries Ltd. Sapporo Reserve
Lager,Tennent Caledonian Breweries Tennent's Lager
Lager,Brasserie Piedboeuf Jupiler
Lager,J. Boag & Son Brewing James Boag's Premium Lager
Lager,Damm S. A. Estrella Damm Daura
Lager,Mill Street Brew Pub Mill Street Original Organic Lager
Lager,Karbach Brewing Co. Sympathy For The Lager
Lager,Tuborgs Bryggerier A/S Tuborg Pilsner Beer (Green / Grøn)
Lager,Brauerei Göss (Brau Union) Gösser
Lager,Hite Brewery Company LTD Hite
Lager,Beijing Yanjing Beer Group Corporation Yanjing Beer
Lager,Lech Browary Wielkopolski (SABMiller) Lech Premium
Lager,Baltika Breweries Baltika #5 Gold
Lager,Royal Unibrew A/S Faxe Premium Danish Lager
Lager,Brasseries Du Maroc Casablanca Beer
Lager,Mahou S.A. Cinco Estrellas
Lager,Brasserie de Tahiti S.A. Hinano
Lager,Browerij Nacional Balashi Balashi
Lager,Tuborgs Bryggerier A/S Tuborg Premium Lager (Gold / Guld)
Lager,Carlsberg Danmark A/S Elephant Beer
Lager,Baltika Breweries Baltika #9 Extra (Strong)
Lager,Browary Warka Sp. z o.o. Warka Strong
Lager,Ceylon / Lion Brewery Limited Lion Imperial Premium Malt Pilsner
Lager,"Grupo Cervezas Alhambra, SL Reserva 1925"
Lager,Elbrewery Co. Ltd. Sp. z o.o. Hevelius Kaper
Lager,Rinkuškiai Alaus Darykloje Lobster Lovers Beer
Lager,Browar Okocim S.A. (Carlsberg) Okocim Mocne
Lager,Royal Unibrew A/S Faxe Extra Strong
Lager,Bierbrouwerij Sint Christoffel B.V Christoffel Nobel
Lager,Rinkuškiai Alaus Darykloje Before-After Premium Lager
Lager,Les Brasseurs de Gayant Bière Du Démon
Lager,Ceres Brewery (Royal Unibrew) Ceres Strong Ale Export
Lager,Tennent Caledonian Breweries Tennent's Super Strong Lager
Lager,Alaus Darykla Kalnapilis Kalnapilis 7.30
Lager,Gubernija Brewery Gubernija Grand 9.5 Beer
Lager,BOSS Browar Witnica S.A. Boss Beer
Lager,Crest Brewing Company Crest Super Premium Lager
Lager,Rinkuškiai Alaus Darykloje aibo
Lager,Anadolu Efes Brewery Efes Extra
Lager,Zywiec Breweries PLC (Heineken) Tatra
Lager,Carlsberg Danmark A/S Special Brew
Lager,John Martin's (John Martin SA) Gordon Finest Gold
Lager,Baltika Breweries Arsenalnoye Krepkoye (Strong)
Lager,"Grolsch Bierbrouwerij N.V. Amsterdam Navigator 8,4"
Lager,Grupo Cruzcampo SA Cruzcampo Gran Reserve
Lager,San Miguel Fabricas De Cervaza Y Maltas S.A. San Miguel Selecta
Lager,Minipivovar U Medvídků X-Beer 33
Lager,"Rinkuškiai Alaus Darykloje Zhiguly Grande 9,5"
Lager,Amstel Brouwerij B. V. Amstel Gold
Lager,Brasserie Des Gabariers (L&L Cognac SA) XO Beer
Lager,Rinkuškiai Alaus Darykloje Aiko
Lager,"Cervezas Moritz, S.A. Moritz Epidor"
Lager,Slavutych Brewery Slavutich Mitzne
Lager,Baltika Breweries Yarpivo Strong (Krepkoye)
Lager,Royal Unibrew A/S Faxe Strong
Lager,Browar Van Pur S.A. (Brau Union Polska) Karpackie
Lager,Gulpener Bierbrouwerij B.V. Gulpener Gladiator Robuust Bier
Lager,Pivovar Náchod a.s. Primátor 21% Rytírský (Knight's Lager)
Lager,Bayerische Staatsbrauerei Weihenstephan Weihenstephaner Original
Lager,Hofbräuhaus München Hofbräu Original
Lager,Spaten-Franziskaner-Bräu Spaten Münchner Hell (Premium Lager)
Lager,New Glarus Brewing Company Two Women Lager
Lager,Surly Brewing Company Hell
Lager,Paulaner Brauerei GmbH & Co. KG Paulaner Original Münchner
Lager,Victory Brewing Company Victory Lager
Lager,Löwenbräu AG Löwenbräu Original
Lager,Brauerei Heller-Trum / Schlenkerla Aecht Schlenkerla Helles Lagerbier
Lager,Cigar City Brewing Hotter Than Helles
Lager,Hacker-Pschorr Bräu GmbH Hacker-Pschorr Münchner Gold
Lager,Three Floyds Brewing Co. & Brewpub Gorch Fock
Lager,Maui Brewing Co. Bikini Blonde Lager
Lager,Ballast Point Brewing Company Longfin Lager
Lager,Stoudts Brewing Co. Stoudt's Gold Lager
Lager,Stieglbrauerei zu Salzburg GmbH Stiegl Goldbräu
Lager,Sly Fox Brewing Company Helles Golden Lager
Lager,"Hijos De Rivera, S.A. Estrella Galicia"
Lager,Firestone Walker Brewing Co. Firestone Lager
Lager,Pennsylvania Brewing Company Penn Gold
Lager,Henninger Bräu AG Henninger Premium Lager
Lager,Devils Backbone Brewing Company Gold Leaf Lager
Lager,Christian Moerlein Brewing Company Christian Moerlein Lager House Original Golden Helles
Lager,Thomas Hooker Brewing Company Thomas Hooker Munich Style Lager
Lager,Rahr & Sons Brewing Company Rahr's Blonde
Lager,Rahr & Sons Brewing Company Blonde Lager
Lager,Klosterbrauerei Andechs Andechser Spezial Hell
Lager,Fordham Brewing Company Fordham Helles Lager
Lager,Hacker-Pschorr Bräu GmbH Hacker-Pschorr Münchner Hell
Lager,Hacker-Pschorr Bräu GmbH Hacker-Pschorr Edelhell
Lager,Klosterbrauerei Weltenburg Weltenburger Kloster Barock-Hell
Lager,Okanagan Spring Brewery 1516 Bavarian Lager
Lager,Ninkasi Brewing Company Helles Belles
Lager,Red Oak Brewery Hummin' Bird
Lager,Der HirschBrau/Privatbrauerei Höss Neuschwansteiner
Lager,Ottakringer Brauerei AG Ottakringer Helles
Lager,Jack's Abby Brewing Hoponius Union
Lager,Jack's Abby Brewing Kiwi Rising
Lager,Ballast Point Brewing Company Fathom India Pale Lager
Lager,Wolverine State Brewing Company Gulo Gulo Lager
Lager,"Pyramid Breweries, Inc. Pale Ale"
Lager,Williams Brothers Brewing Company Caesar Augustus (Lager/IPA Hybrid)
Lager,Asahi Breweries Ltd Asahi Super Dry
Lager,Sapporo Breweries Ltd. Sapporo Original Draft Beer
Lager,"Orion Beer Co., Ltd. Orion Premium Draft Beer"
Lager,"Kirin Brewery Company, Limited Kirin Lager"
Lager,Lao Brewery Co. Beerlao Lager
Lager,Sapporo Breweries Ltd. Sapporo Draft Beer
Lager,Uehara Shuzou Co. Ltd. / Echigo Beer Pub Koshihikari Echigo Beer
Lager,Asahi Breweries Ltd Asahi Draft (Jukusen)
Lager,"Kirin Brewery Company, Limited Kirin Classic Lager"
Lager,Asahi Breweries Ltd Asahi Orion
Lager,Asahi Breweries Ltd Asahi Premium
Lager,"Hangzhou Xihu Beer Asahi Co. , Ltd. Siwo"
Lager,Sapporo Breweries Ltd. Sapporo Fuyumonogatari - The Winter's Tale
Lager,Yo-Ho Brewing Company Organic Beer Shinshu Sansan
Lager,Guangzhou Zhujiang Brewery Co. Ltd. Zhujiang Beer
Lager,"Kirin Brewery Company, Limited Kirin Bar Beer"
Lager,"Kirin Brewery Company, Limited Kirin Premium Draft Beer"
Lager,"Kirin Brewery Company, Limited Kirin Ichiban Maribana"
Lager,"Kirin Brewery Company, Limited Kirin Brau Meister"
Lager,Taiwan Tobacco & Liquor Corporation Taiwan Beer
Lager,Great Divide Brewing Company Hapa Beer
Lager,Urban Chestnut Brewing Company Zwickel
Lager,Kulmbacher Brauerei AG Mönchshof Kellerbier (Kellerbräu)
Lager,Hacker-Pschorr Bräu GmbH Hacker-Pschorr Anno 1417
Lager,St. Georgenbräu Buttenheimer Keller Bier
Lager,Creemore Springs Brewery Limited Creemore Springs Kellerbier
Lager,Columbus Brewing Company Columbus Summer Teeth
Lager,Private Landbrauerei Scheuerer Moosbacher Kellerbier
Lager,Brauerei Max Leibinger GmbH Zeppelin Bier
Lager,Brouwerij Drie Fonteinen Beersel Lager
Lager,Les Trois Mousquetaires Série Signature Kellerbier
Lager,Arcobräu Gräfliches Brauhaus Arcobräu Zwickl Lager
Lager,Stieglbrauerei zu Salzburg GmbH Paracelsus Zwickl
Lager,Brauerei Hofstetten Krammer GmbH & Co. KG Kubelbier
Lager,Fürst Wallerstein Brauhaus Fürsten Zwickel
Lager,Brauerei Zehendner GmbH Mönchsambacher Lager
Lager,Anheuser-Busch Bud Light
Lager,Miller Brewing Co. Miller Lite
Lager,Anheuser-Busch Bud Light Lime
Lager,Anheuser-Busch Michelob Ultra
Lager,Boston Beer Company (Samuel Adams) Sam Adams Light
Lager,Anheuser-Busch Natural Light
Lager,Grupo Modelo S.A. de C.V. Corona Light
Lager,Coors Brewing Company Keystone Light
Lager,Anheuser-Busch Bud Light Platinum
Lager,"Tsingtao Brewery Co., Ltd. Five Star All Malt Beer"
Lager,Anheuser-Busch Busch Light
Lager,Amstel Brouwerij B. V. Amstel Light
Lager,Anheuser-Busch Budweiser Select
Lager,Heineken Nederland B.V. Heineken Premium Light Lager
Lager,Anheuser-Busch Michelob Light
Lager,Miller Brewing Co. Miller High Life Light
Lager,Miller Brewing Co. Milwaukee's Best Light
Lager,Labatt Brewing Company Ltd. Labatt Blue Light
Lager,Anheuser-Busch Budweiser Select 55
Lager,Anheuser-Busch Michelob Ultra Amber
Lager,Anheuser-Busch Michelob Golden Draft Light
Lager,"Cervecería Cuauhtémoc Moctezuma, S.A. de C.V. Tecate Light"
Lager,Anheuser-Busch Michelob Ultra Lime Cactus
Lager,Cisco Brewers Inc. Sankaty Light
Lager,Miller Brewing Co. Miller Genuine Draft Light 64
Lager,Spoetzl Brewery Shiner Light Blonde
Lager,Genesee Brewing Co. / Dundee Brewing Co. Genny Light
Lager,Pittsburgh Brewing Co. I.C. Light
Lager,Compañía Cervecera de Puerto Rico Medalla Light
Lager,Pabst Brewing Company Old Milwaukee Light
Lager,Brauerei Beck & Co. Beck's Premier Light
Lager,"Kirin Brewery Company, Limited Kirin Light Beer"
Lager,Anheuser-Busch Michelob Ultra Pomegranate Raspberry
Lager,Spoetzl Brewery Shiner Light
Lager,Abita Brewing Co. Light
Lager,Desnoes & Geddes Limited Red Stripe Light
Lager,Molson Coors Canada Molson Canadian Light
Lager,Brauerei Beck & Co. Beck's Light
Lager,Pabst Brewing Company Pabst Blue Ribbon Light
Lager,Cerveceria Nacional Dominicana Presidente Light
Lager,Miller Brewing Co. Mickey's
Lager,Steel Brewing Company Steel Reserve 211 (High Gravity)
Lager,Miller Brewing Co. Olde English 800
Lager,Pabst Brewing Company Colt 45 Malt Liquor
Lager,Molson Coors Canada Molson XXX
Lager,Anheuser-Busch King Cobra Premium Malt Liquor
Lager,Anheuser-Busch Natty Daddy
Lager,Anheuser-Busch Hurricane
Lager,Miller Brewing Co. Magnum
Lager,Saint Ides Brewing Company St. Ides High Gravity Malt Liquor
Lager,Miller Brewing Co. Olde English 800 High Gravity
Lager,Genesee Brewing Co. / Dundee Brewing Co. Dog Bite High Gravity Lager
Lager,Shaw Wallace & Company Ltd. Haywards 5000 Super Premium Beer
Lager,JOS. Schlitz Brewing Co. (Pabst) Schlitz High Gravity V.S.L Very Smooth Lager
Lager,Labatt Brewing Company Ltd. Labatt Ice
Lager,Pabst Brewing Company Country Club Malt Liquor
Lager,Steel Brewing Company Steel Reserve 211 Triple Export
Lager,Pabst Brewing Company Colt 45 High Gravity Lager
Lager,Mohan Breweries & Distilleries Ltd Old Monk 10000
Lager,Camo Brewing Company Camo Black Ice
Lager,Three Floyds Brewing Co. & Brewpub Region Riot
Lager,Pabst Brewing Company Colt 45 Double Malt Liquor
Lager,"City Brewing Company, LLC Crazy Stallion"
Lager,Camo Brewing Company Camo Silver ICE
Lager,Melanie Brewing Company Evil Eye
Lager,Camo Brewing Company Camo High Gravity Lager
Lager,United Brands Company Stack High Gravity Lager
Lager,Molson Coors Canada Brador
Lager,"City Brewing Company, LLC Earthquake High Gravity Lager"
Lager,JOS. Schlitz Brewing Co. (Pabst) Schlitz Red Bull X. L. Xtra Long Malt Liquor
Lager,Minhas Craft Brewery Axe Head Malt Liquor
Lager,Minhas Craft Brewery Clear Creek Ice
Lager,Camo Brewing Company Camo Black Extra
Lager,Boston Beer Company (Samuel Adams) Samuel Adams Octoberfest
Lager,Paulaner Brauerei GmbH & Co. KG Paulaner Oktoberfest-Märzen
Lager,Spaten-Franziskaner-Bräu Spaten Oktoberfestbier Ur-Märzen
Lager,Great Lakes Brewing Company Great Lakes Oktoberfest
Lager,Victory Brewing Company Festbier
Lager,Hacker-Pschorr Bräu GmbH Hacker-Pschorr Oktoberfest-Märzen
Lager,Bayerische Staatsbrauerei Weihenstephan Weihenstephaner Festbier
Lager,Jacob Leinenkugel Brewing Company Leinenkugel's Oktoberfest
Lager,Hofbräuhaus München Hofbräu Oktoberfestbier
Lager,Avery Brewing Company The Kaiser
Lager,Left Hand Brewing Company Left Hand Oktoberfest
Lager,Harpoon Brewery Catamount Octoberfest Beer
Lager,Spoetzl Brewery Shiner Oktoberfest
Lager,New Glarus Brewing Company Staghorn Octoberfest
Lager,Great Divide Brewing Company Hoss
Lager,Flying Dog Brewery Dogtoberfest
Lager,Yuengling Brewery Oktoberfest
Lager,Brauerei Beck & Co. Beck's Oktoberfest
Lager,Gordon Biersch Brewery Restaurant Gordon Biersch Märzen
Lager,Three Floyds Brewing Co. & Brewpub Munsterfest
Lager,Firestone Walker Brewing Co. Oaktoberfest
Lager,Warsteiner Brauerei Warsteiner Premium Oktoberfest
Lager,Boulevard Brewing Co. Bob's '47 Oktoberfest
Lager,Summit Brewing Company Summit Oktoberfest Marzen
Lager,Paulaner Brauerei GmbH & Co. KG Paulaner Wiesn Bier
Lager,Jack's Abby Brewing Copper Legend
Lager,Two Brothers Brewing Company Atom Smasher
Lager,Saint Arnold Brewing Company Saint Arnold Oktoberfest
Lager,Stoudts Brewing Co. Oktober Fest
Lager,Blue Point Brewing Company Blue Point Oktoberfest
Lager,Flying Fish Brewing Company OktoberFish
Lager,Sly Fox Brewing Company Oktoberfest
Lager,Narragansett Brewing Co. Narragansett Fest
Lager,August Schell Brewing Company Oktoberfest
Lager,Capital Brewery Oktoberfest
Lager,"Lakefront Brewery, Inc. Oktoberfest Lager Beer"
Lager,Thirsty Dog Brewing Company Barktoberfest
Lager,Genesee Brewing Co. / Dundee Brewing Co. Dundee Oktoberfest
Lager,Sprecher Brewing Company Oktoberfest
Lager,Grupo Modelo S.A. de C.V. Negra Modelo
Lager,Warsteiner Brauerei Warsteiner Premium Dunkel
Lager,Hofbräuhaus München Hofbräu Dunkel
Lager,Brauerei Beck & Co. Beck's Dark
Lager,Harpoon Brewery Barrel Aged Munich Dark
Lager,Spaten-Franziskaner-Bräu Spaten Dunkel
Lager,"Lakefront Brewery, Inc. Eastside Dark"
Lager,Pennsylvania Brewing Company Penn Dark
Lager,Mother Earth Brewing Dark Cloud
Lager,Klosterbrauerei Weltenburg Weltenburger Kloster Barock Dunkel
Lager,Asahi Breweries Ltd Asahi Black (Kuronama)
Lager,Flensburger Brauerei GmbH Und Co. KG Flensburger Dunkel
Lager,Church Brew Works Pious Monk Dunkel
Lager,Capital Brewery Capital Dark
Lager,Kaltenberg International / König Ludwig International GmbH & Co.KG König Ludwig Dunkel
Lager,Christian Moerlein Brewing Company Barbarossa Double Dark Lager
Lager,Jack's Abby Brewing Red Tape Lager
Lager,Surly Brewing Company Schadenfreude
Lager,Klosterbrauerei Ettal / Ettaler Klosterbetriebe GmbH Ettaler Kloster Dunkel
Lager,Der HirschBrau/Privatbrauerei Höss Holzar-Bier
Lager,Sly Fox Brewing Company Dunkel Lager
Lager,Sprecher Brewing Company Winter Brew
Lager,Franconia Brewing Company Franconia Dunkel
Lager,Matt Brewing Company Saranac Lake Effect Lager
Lager,Brauerei Hirt GmbH Hirter Morchl
Lager,The Olde Mecklenburg Brewery Dunkel Lager
Lager,Brauerei Göss (Brau Union) Gösser Dark Beer
Lager,Brauerei Pinkus Mueller Organic Pinkus Jubilate
Lager,Grupo Modelo S.A. de C.V. León
Lager,Hacker-Pschorr Bräu GmbH Hacker-Pschorr Münchner Dunkel
Lager,Matt Brewing Company Saranac Lager
Lager,Grimm Brothers Brewhouse Fearless Youth
Lager,Paulaner Brauerei GmbH & Co. KG Paulaner Original Münchner Dunkel
Lager,Klosterbrauerei Andechs Andechser Dunkel
Lager,Bayerische Staatsbrauerei Weihenstephan Weihenstephaner Tradition
Lager,Mahou S.A. Negra
Lager,Brauerei Heller-Trum / Schlenkerla Aecht Schlenkerla Rauchbier Märzen
Lager,Brauerei Heller-Trum / Schlenkerla Aecht Schlenkerla Rauchbier UrBock
Lager,Jack's Abby Brewing Smoke & Dagger
Lager,Brauerei Heller-Trum / Schlenkerla Aecht Schlenkerla Eiche
Lager,Brauerei Heller-Trum / Schlenkerla Aecht Schlenkerla Rauchbier Weizen
Lager,Brauerei Heller-Trum / Schlenkerla Aecht Schlenkerla Fastenbier
Lager,Caldera Brewing Company Rauch Ür Bock
Lager,Cervejaria Sudbrack Ltda Eisenbahn Rauchbier
Lager,Roy Pitz Brewing Company Ludwig's Revenge
Lager,Brauerei Göller Zur Alten Freyung Göller Rauchbier
